<<<<<<< HEAD:data-science/datasets/datasets-origin/sentimentdataset_es.csv
Unnamed: 0.1;Unnamed: 0;Text;Sentiment;Timestamp;User;Platform;Hashtags;Retweets;Likes;Country;Year;Month;Day;Hour
0;0;Disfrutando de un hermoso da en el parque!;Positivo;15-01-2023 12:30;User123;Twitter;#Naturaleza #Parque;15;30;EE.UU;2023;1;15;12
1;1;Esta maana el trfico era terrible.;Negativo;15-01-2023 8:45;CommuterX;Twitter;#Trfico #Maana;5;10;Canad;2023;1;15;8
2;2;Acabo de terminar un entrenamiento increble!??;Positivo;15-01-2023 15:45;FitnessFan;Instagram;#Fitness #Entrenamiento;20;40;EE.UU;2023;1;15;15
3;3;Emocionado por la escapada de fin de semana que viene!;Positivo;15-01-2023 18:20;AdventureX;Facebook;#Viajes #Aventura;8;15;Reino Unido;2023;1;15;18
4;4;Probando una nueva receta para cenar esta noche.;Neutral;15-01-2023 19:55;ChefCook;Instagram;#Cocinar #Comida;12;25;Australia;2023;1;15;19
5;5;Sentirme agradecido por las pequeas cosas de la vida.;Positivo;16-01-2023 9:10;GratitudeNow;Twitter;#Gratitud #VibracionesPositivas;25;50;India;2023;1;16;9
6;6;Los das de lluvia requieren mantas cmodas y chocolate caliente.;Positivo;16-01-2023 14:45;RainyDays;Facebook;#Daslluviosos #Acogedor;10;20;Canad;2023;1;16;14
7;7;El estreno de la nueva pelcula es imprescindible!;Positivo;16-01-2023 19:30;MovieBuff;Instagram;#NocheDeCine #DebesVer;15;30;EE.UU;2023;1;16;19
8;8;Las discusiones polticas se intensifican en la lnea de tiempo.;Negativo;17-01-2023 8:00;DebateTalk;Twitter;#Poltica #Debate;30;60;EE.UU;2023;1;17;8
9;9;Extraando las vibraciones del verano y los das de playa.;Neutral;17-01-2023 12:20;BeachLover;Facebook;#Verano #DasDePlaya;18;35;Australia;2023;1;17;12
10;10;Acabo de publicar una nueva entrada en el blog.chale un vistazo!;Positivo;17-01-2023 15:15;BloggerX;Instagram;#Blogging #NuevaPublicacin;22;45;EE.UU;2023;1;17;15
11;11;Me siento un poco mal hoy.;Negativo;18-01-2023 10:30;WellnessCheck;Twitter;#DaEnfermo #Salud;7;15;Canad;2023;1;18;10
12;12;Explorando las joyas ocultas de la ciudad.;Positivo;18-01-2023 14:50;UrbanExplorer;Facebook;#ExploraLaCiudad #JoyasEscondidas;12;25;Reino Unido;2023;1;18;14
13;13;Ao nuevo, nuevos objetivos de fitness!??;Positivo;18-01-2023 18:00;FitJourney;Instagram;#AoNuevo #MetasDeFitness;28;55;EE.UU;2023;1;18;18
14;14;La tecnologa est cambiando la forma en que vivimos.;Neutral;19-01-2023 9:45;TechEnthusiast;Twitter;#Tecnologa #Innovacin;15;30;India;2023;1;19;9
15;15;Reflexionando sobre el pasado y mirando hacia el futuro.;Positivo;19-01-2023 13:20;Reflections;Facebook;#Reflexin #Futuro;20;40;EE.UU;2023;1;19;13
16;16;Acabo de adoptar a un lindo amigo peludo!??;Positivo;19-01-2023 17:10;PetAdopter;Instagram;#Adopcindemascotas #AmigoPeludo;15;30;Canad;2023;1;19;17
17;17;Sesin de juegos nocturna con amigos.;Positivo;20-01-2023 0:05;GamerX;Twitter;#Juegos #Tarde en la noche;18;35;Reino Unido;2023;1;20;0
18;18;Asistir a una conferencia virtual sobre IA.;Neutral;20-01-2023 11:30;TechConference;Facebook;#AI #ConferenciaTecnolgica;25;50;EE.UU;2023;1;20;11
19;19;La tristeza invernal me hizo sentir deprimido.;Negativo;20-01-2023 15:15;WinterBlues;Instagram;#DepresinInvernal #Estado de nimo;8;15;EE.UU;2023;1;20;15
20;20;Tomando caf y disfrutando de un buen libro.;Positivo;21-01-2023 8:40;Bookworm;Twitter;#Lectura #Horadelcafe;22;45;India;2023;1;21;8
21;21;Explorando el mundo de la realidad virtual.;Positivo;21-01-2023 13:20;VRExplorer;Facebook;#VR #RealidadVirtual;15;30;EE.UU;2023;1;21;13
22;22;Da productivo marcando mi lista de tareas pendientes.;Positivo;21-01-2023 16:45;ProductivityPro;Instagram;#Productividad #TrabajoDesdeCasa;30;60;EE.UU;2023;1;21;16
23;23;Acabo de terminar una rutina de ejercicios desafiante.;Positivo;22-01-2023 9:15;FitnessWarrior;Twitter;#Fitness #RetoAceptado;20;40;Reino Unido;2023;1;22;9
24;24;Celebrando un hito en el trabajo!??;Positivo;22-01-2023 14:30;CareerMilestone;Facebook;#Carrera #Hito;12;25;Canad;2023;1;22;14
25;25;Brunch del domingo con amigos.;Positivo;22-01-2023 12:00;BrunchBuddy;Instagram;#Brunch #Amigos;15;30;Reino Unido;2023;1;22;12
27;28;Aprender un nuevo idioma para el crecimiento personal.;Positivo;23-01-2023 16:20;LanguageLearner;Facebook;#AprendizajedeIdiomas #CrecimientoPersonal;25;50;India;2023;1;23;16
28;29;Tarde tranquila con un buen libro.;Positivo;23-01-2023 19:45;BookLover;Instagram;#Leyendo #TiempoTranquilo;15;30;Australia;2023;1;23;19
29;30;Reflexionando sobre la importancia de la salud mental.;Positivo;24-01-2023 11:30;MentalHealthMatters;Twitter;#SaludMental #Autocuidado;22;45;EE.UU;2023;1;24;11
30;31;Nueva pintura en progreso!??;Positivo;24-01-2023 15:00;ArtistInAction;Facebook;#Arte #PinturaEnProgreso;12;25;Canad;2023;1;24;15
31;32;Viaje por carretera de fin de semana para explorar vistas panormicas.;Positivo;24-01-2023 17:30;RoadTripper;Instagram;#RoadTrip #VistasEscnicas;18;35;Reino Unido;2023;1;24;17
32;33;Disfrutando de una taza de t y contemplando el atardecer.;Positivo;25-01-2023 18:00;SunsetWatcher;Twitter;#HoradelT #Atardecer;15;30;India;2023;1;25;18
33;34;Codificando un nuevo proyecto con entusiasmo.;Positivo;25-01-2023 13:15;CodeEnthusiast;Facebook;#Codificacin #Entusiasmo;30;60;EE.UU;2023;1;25;13
34;35;Sentirme inspirado tras asistir a un taller.;Positivo;26-01-2023 9:45;WorkshopAttendee;Instagram;#Inspiracin #Taller;25;50;EE.UU;2023;1;26;9
35;36;Jornada de deportes de invierno en el parque local.;Positivo;26-01-2023 14:20;WinterSports;Twitter;#Deportes de invierno #Diversin;15;30;Canad;2023;1;26;14
36;37;Tiempo de calidad con la familia este fin de semana.;Positivo;26-01-2023 17:40;FamilyTime;Facebook;#TiempoEnFamilia #Fin De Semana;22;45;Reino Unido;2023;1;26;17
37;38;Asistiendo a un concierto de msica en vivo esta noche.;Positivo;27-01-2023 20:00;MusicLover;Instagram;#Msica #NocheDeConcierto;18;35;EE.UU;2023;1;27;20
38;39;Practicando la atencin plena con la meditacin.;Positivo;27-01-2023 12:30;MindfulMoments;Twitter;#Atencin plena #Meditacin;15;30;India;2023;1;27;12
39;40;Probando una nueva receta de postre.;Positivo;27-01-2023 16:10;DessertExplorer;Facebook;#Postre #Cocina;12;25;Canad;2023;1;27;16
40;41;Estoy emocionado por el prximo torneo de videojuegos.;Positivo;28-01-2023 9:00;GamingEnthusiast;Instagram;#Juegos #Torneo;30;60;EE.UU;2023;1;28;9
41;42;Planificando una renovacin del jardn para la primavera.;Positivo;28-01-2023 14:45;GardenPlanner;Twitter;#Jardinera #Primavera;25;50;EE.UU;2023;1;28;14
42;43;Celebrando el cumpleaos de un amigo esta noche!??;Positivo;28-01-2023 19:30;BirthdayBash;Facebook;#Cumpleaos #Celebracin;15;30;Reino Unido;2023;1;28;19
43;44;Sentirse realizado despus de un da productivo.;Positivo;29-01-2023 17:00;ProductivityWin;Instagram;#Logrado #xito;22;45;India;2023;1;29;17
44;45;Una velada acogedora con una buena pelcula.;Positivo;29-01-2023 20:20;MovieNight;Twitter;#NocheAcogedora #TiempoDePelcula;18;35;Canad;2023;1;29;20
45;46;Explorando galeras de arte locales este fin de semana.;Positivo;30-01-2023 11:30;ArtExplorer;Facebook;#Arte #GaleraExplorar;15;30;EE.UU;2023;1;30;11
46;47;Nuevo libro publicado por mi autor favorito!;Positivo;30-01-2023 15:45;BookwormX;Instagram;#LibroLibro #AutorFavorito;12;25;Reino Unido;2023;1;30;15
47;48;Asistir a una reunin de realidad virtual.;Positivo;30-01-2023 18:30;VRMeetup;Twitter;#VRMeetup #RealidadVirtual;28;55;India;2023;1;30;18
48;49;Reflexionando sobre la belleza de la naturaleza.;Positivo;31-01-2023 10:45;NatureLover;Facebook;#Naturaleza #Reflexin;15;30;Australia;2023;1;31;10
49;50;Cocinar una cena especial para los seres queridos.;Positivo;31-01-2023 19:00;ChefAtHome;Instagram;#Cocina #CenaEspecial;20;40;EE.UU;2023;1;31;19
50;51;Sentirse optimista sobre la semana que viene.;Positivo;31-01-2023 16:20;OptimisticMindset;Twitter;#Optimismo #NuevaSemana;15;30;Canad;2023;1;31;16
51;52;Maana empezamos un nuevo reto fitness!??;Positivo;01-02-2023 8:00;FitnessChallenge;Facebook;#FitnessChallenge #NuevosComienzos;22;45;Reino Unido;2023;2;1;8
52;53;Paseo dominical en bicicleta por senderos panormicos.;Neutral;01-02-2023 13:30;BikeExplorer;Instagram;#PaseoEnBicicleta #SenderosEscnicos;18;35;EE.UU;2023;2;1;13
53;55;No puedo creer la injusticia que est sucediendo en nuestra sociedad.;Enojo;11-02-2023 9:30;SocialJustice;Twitter;#Injusticia #Enojado;20;40;Canad;2023;2;11;9
54;56;Sentir miedo despus de ver una pelcula de suspenso.;Miedo;11-02-2023 21:15;ThrillerFan;Instagram;#Miedo #Pelculade suspense;15;30;EE.UU;2023;2;11;21
55;57;Con el corazn roto tras escuchar la noticia sobre un desastre natural.;Tristeza;12-02-2023 14:45;EmpathyFirst;Facebook;#Tristezaza #DesastreNatural;25;50;India;2023;2;12;14
56;58;El estado del medio ambiente mundial es simplemente repugnante.;Asco;12-02-2023 18:20;EcoAwareness;Twitter;#Asgusto #Medio Ambiente;18;35;Reino Unido;2023;2;12;18
57;59;Pura felicidad: celebrar el logro de un ser querido!;Felicidad;13-02-2023 10:00;ProudFriend;Instagram;#Felicidad #Celebracin;30;60;EE.UU;2023;2;13;10
58;60;La risa es la mejor medicina: disfrutar de un espectculo de comedia.;Alegra;13-02-2023 19:30;ComedyFan;Facebook;#Alegra #ComediaShow;22;45;Canad;2023;2;13;19
59;61;Compartiendo amor y vibraciones positivas con todos!??;Amor;14-02-2023 8:30;LoveSpreader;Twitter;#Amor #DifundeAmor;15;30;Australia;2023;2;14;8
60;62;Un incidente divertido alegr mi da!;Diversin;14-02-2023 14:20;AmusedSoul;Instagram;#Diversin #Diversin;18;35;Reino Unido;2023;2;14;14
61;63;Disfrutando de una velada tranquila con un libro y un t.;Disfrute;14-02-2023 19:45;BookLoverAgain;Facebook;#Disfrute #TiempoDeReservar;25;50;Canad;2023;2;14;19
62;64;Admirar la belleza de la naturaleza durante una caminata tranquila.;Admiracin;15-02-2023 11:30;NatureAdmirer;Twitter;#Admiracin #Naturaleza;20;40;EE.UU;2023;2;15;11
63;65;Enviando vibras cariosas a todos mis seguidores!;Positivo;15-02-2023 16:00;AffectionSender;Instagram;#Afecto #VibracionesPositivas;15;30;EE.UU;2023;2;15;16
64;66;Experimentar asombro ante la impresionante puesta de sol.;Positivo;15-02-2023 20:30;AweStruck;Facebook;#Awesome #Impresionante;22;45;Australia;2023;2;15;20
65;67;Decepcin con el servicio en un restaurante local.;Decepcin;16-02-2023 9:00;FoodieGoneWrong;Twitter;#Disappointed #BadService;18;35;India;2023;2;16;9
66;68;Un regalo sorpresa de una amiga me alegr el da!;Sorpresa;16-02-2023 14:45;HappySurprise;Instagram;#Sorpresa #Regalo;25;50;EE.UU;2023;2;16;14
67;69;Encontrar aceptacin en medio de los desafos de la vida.;Positivo;16-02-2023 18:20;AcceptanceSeeker;Facebook;#Aceptacin #Retos;15;30;Canad;2023;2;16;18
68;70;Rebosante de adoracin por mi adorable mascota!??;Adoracin;17-02-2023 10:45;PetAdorer;Twitter;#Adoracin #AmordeMascotas;22;45;Reino Unido;2023;2;17;10
69;71;Anticipando una emocionante aventura en las prximas semanas.;Anticipacin;17-02-2023 7:30;AdventureAwaits;Instagram;#Anticipacin #Aventura;20;40;EE.UU;2023;2;17;7
70;72;Una amarga experiencia se convirti en una valiosa leccin.;Amargura;17-02-2023 15:00;LearnFromBitter;Facebook;#LeccinAmarga #Crecimiento;18;35;EE.UU;2023;2;17;15
71;73;Encontrar la calma en medio de un da ajetreado.;Neutral;18-02-2023 9:30;ZenMaster;Twitter;#Calma #MenteEnPaz;15;30;India;2023;2;18;9
72;74;La confusin nubla mi mente mientras tomo decisiones.;Neutral;18-02-2023 14:20;ConfusedMind;Instagram;#Confusin #TomadeDecisiones;25;50;Reino Unido;2023;2;18;14
73;75;Emocin creciente por las prximas vacaciones!;Excitacin;18-02-2023 18:45;VacationDreamer;Facebook;#Emocin #PlanesdeViaje;22;45;Canad;2023;2;18;18
74;76;La bondad presenciada hoy restableci mi fe en la humanidad.;Amabilidad;19-02-2023 11:30;KindnessPrevails;Twitter;#Bondad #Humanidad;20;40;EE.UU;2023;2;19;11
75;77;Orgullo por lograr un hito personal.;Orgullo;19-02-2023 16:00;PersonalAchiever;Instagram;#Orgullo #Hito;30;60;Australia;2023;2;19;16
76;78;Un momento de Verguenza por no enfrentar la injusticia.;Lstima;19-02-2023 19:45;ReflectiveSelf;Facebook;#Verguenza #Injusticia;15;30;India;2023;2;19;19
77;79;Furioso de ira despus de una acalorada discusin.;Enojo;20-02-2023 9:30;AngryDebater;Twitter;#Ira #Argumento;20;40;Canad;2023;2;20;9
78;80;El miedo a lo desconocido me mantiene despierto por la noche.;Miedo;20-02-2023 21:15;FearfulDreamer;Instagram;#Miedo #Desconocido;15;30;EE.UU;2023;2;20;21
79;81;Sentida tristeza tras despedirnos de un querido amigo.;Negativo;21-02-2023 14:45;FarewellHeart;Facebook;#Tristezaza #Despedida;25;50;India;2023;2;21;14
80;82;El estado de corrupcin en nuestra sociedad es absolutamente repugnante.;Asco;21-02-2023 18:20;AntiCorruption;Twitter;#Asco #Corrupcin;18;35;Reino Unido;2023;2;21;18
81;83;Felicidad desbordante: dar la bienvenida a un nuevo miembro de la familia!;Felicidad;22-02-2023 10:00;NewParentJoy;Instagram;#Felicidad #NuevoMiembroDeLaFamilia;30;60;Reino Unido;2023;2;22;10
82;84;La risa es la clave de la alegra: asistir a un espectculo de comedia.;Alegra;22-02-2023 19:30;StandUpFan;Facebook;#Alegra #StandUpComedy;22;45;Canad;2023;2;22;19
83;85;Les envo amor a todos mis seguidores en este hermoso da!??;Amor;23-02-2023 8:30;LoveSender;Twitter;#Amor #DifundeAmor;15;30;Australia;2023;2;23;8
84;86;Divertido por las travesuras de mi mascotaes pura diversin!;Diversin;23-02-2023 14:20;PetAmuser;Instagram;#Diversin #PetAntics;18;35;Reino Unido;2023;2;23;14
85;87;Disfrutando cada momento de este viaje, puro disfrute!;Disfrute;23-02-2023 19:45;TravelExplorer;Facebook;#Disfrute #Viajar;25;50;EE.UU;2023;2;23;19
86;88;Admirando la dedicacin de los voluntarios en una organizacin benfica local.;Admiracin;24-02-2023 11:30;CharityAdmirer;Twitter;#Admiracin #Voluntarios;20;40;EE.UU;2023;2;24;11
87;89;Enviar vibraciones afectuosas a amigos y familiares.;Positivo;24-02-2023 16:00;FamilyLover;Instagram;#Afecto #AmorDeFamilia;15;30;EE.UU;2023;2;24;16
88;90;Asombrado por la belleza del cielo nocturno.;Positivo;24-02-2023 20:30;Stargazer;Facebook;#Awe #NocheEstrella;22;45;Australia;2023;2;24;20
89;91;Decepcin por la falta de avance en un proyecto personal.;Decepcin;25-02-2023 9:00;ProjectStruggle;Twitter;#Proyecto #Decepcin;18;35;India;2023;2;25;9
90;92;Una visita sorpresa de un viejo amigo le hizo llorar de alegra.;Sorpresa;25-02-2023 14:45;JoyfulReunion;Instagram;#Sorpresa #ViejosAmigos;25;50;EE.UU;2023;2;25;14
91;93;Abrazar la aceptacin de los altibajos de la vida.;Positivo;25-02-2023 18:20;LifeAcceptance;Facebook;#Aceptacin #ViajeDeVida;15;30;Canad;2023;2;25;18
92;94;Adoracin desbordante por un lindo cachorro rescatado!??;Adoracin;26-02-2023 10:45;PuppyAdmirer;Twitter;#Adoracin #AmordeCachorro;22;45;Reino Unido;2023;2;26;10
93;95;Anticipando el estreno de una pelcula muy esperada.;Anticipacin;26-02-2023 7:30;MovieBuff2;Instagram;#Anticipacin #EstrenoPelcula;20;40;Australia;2023;2;26;7
94;96;Amarga experiencia en el departamento de atencin al cliente.;Negativo;26-02-2023 15:00;CustomerWoes;Facebook;#ExperienciaAmarga #ServicioAlCliente;18;35;EE.UU;2023;2;26;15
95;97;Encontrar la calma en medio del caos de la vida diaria.;Neutral;27-02-2023 9:30;CalmSoul;Twitter;#Calma #PazInterior;15;30;India;2023;2;27;9
96;98;Reina la confusin mientras trato de darle sentido a los acontecimientos recientes.;Neutral;27-02-2023 14:20;ConfusedMind2;Instagram;#Confusin #Dar sentido;25;50;Reino Unido;2023;2;27;14
97;99;La emocin aumenta por una fiesta de cumpleaos sorpresa.;Excitacin;27-02-2023 18:45;BirthdayExcite;Facebook;#Emocin #FiestaSorpresa;22;45;Canad;2023;2;27;18
98;100;Fui testigo de un acto de bondad que me alegr el da.;Amabilidad;28-02-2023 11:30;KindnessObserver;Twitter;#Bondad #ActosDeBondad;20;40;EE.UU;2023;2;28;11
99;101;Orgullo de completar un desafiante desafo de acondicionamiento fsico.;Orgullo;28-02-2023 16:00;FitAchiever;Instagram;#Orgullo #DesafoFitnessCompletado;30;60;Reino Unido;2023;2;28;16
100;102;Un momento de Verguenza por no denunciar la injusticia.;Lstima;28-02-2023 19:45;ReflectiveSelf2;Facebook;#Verguenza #Injusticia;15;30;India;2023;2;28;19
101;103;Reflexionando sobre la belleza de la diversidad en nuestro mundo.;Neutral;01-03-2023 10:45;DiversityLover;Twitter;#Aceptacin #Diversidad;22;45;Australia;2023;3;1;10
102;104;Emocin por una velada tranquila con un buen libro.;Excitacin;01-03-2023 13:30;BookwormJoy;Instagram;#Emocin #TiempodeLibro;18;35;EE.UU;2023;3;1;13
103;105;Me siento amargado por la injusticia en el trabajo.;Negativo;01-03-2023 17:45;WorkplaceWoes;Twitter;#Bitter #Unfairness;15;30;Canad;2023;3;1;17
104;106;La calma prevalece mientras practico la atencin plena.;Neutral;02-03-2023 18:00;MindfulMe;Facebook;#Calma #Atencin plena;15;30;Reino Unido;2023;3;2;18
105;107;La confusin me rodea mientras navego por las elecciones de la vida.;Neutral;02-03-2023 13:15;ConfusedMind3;Instagram;#Confusin #OpcionesdeVida;30;60;EE.UU;2023;3;2;13
106;108;Emocin por un viaje por carretera de fin de semana para explorar nuevos lugares.;Excitacin;02-03-2023 16:45;RoadTripper2;Twitter;#Emocin #AventuraDeFin De Semana;25;50;India;2023;3;2;16
107;109;La bondad presenciada hoy restaura mi fe en la humanidad.;Amabilidad;03-03-2023 11:30;KindnessPrevails2;Facebook;#Bondad #HumanidadRestaurada;22;45;EE.UU;2023;3;3;11
108;110;Orgullo por lograr objetivos personales y profesionales.;Orgullo;03-03-2023 14:30;GoalAchiever;Instagram;#Orgullo #Logros;12;25;Canad;2023;3;3;14
109;111;Lstima por no ser fiel a mis valores en una situacin difcil.;Lstima;03-03-2023 12:00;ReflectiveSelf3;Twitter;#Verguenza #Integridad;15;30;Reino Unido;2023;3;3;12
110;112;Revisando viejos recuerdos, sintiendo una sensacin de euforia.;Positivo;15-05-2010 15:30;NostalgiaFan;Twitter;#Euforia #Recuerdos;20;40;Canad;2010;5;15;15
111;113;La victoria de nuestro equipo trajo euforia a la ciudad.;Euforia;10-08-2021 21:15;SportsFanatic;Instagram;#Euforia #Victoria;15;30;EE.UU;2021;8;10;21
112;114;Abrazar la belleza de la naturaleza, un momento de satisfaccin.;Positivo;20-06-2011 14:45;NatureLover2;Facebook;#Alegra #Naturaleza;25;50;India;2011;6;20;14
113;115;Meditando junto al sereno lago, encontrando la paz interior.;Neutral;12-02-2022 18:20;ZenMaster2;Twitter;#Serenidad #Meditacin;18;35;Reino Unido;2022;2;12;18
114;116;Rebosante de gratitud por las bendiciones de la vida.;Gratitud;25-11-2012 10:00;ThankfulHeart;Instagram;#Gratitud #Bendito;30;60;Australia;2012;11;25;10
115;117;Esperanza de un maana mejor, a pesar de los desafos.;Esperanza;05-04-2013 19:30;OptimisticSoul;Facebook;#Esperanza #Optimismo;22;45;EE.UU;2013;4;5;19
116;118;Empoderado para marcar la diferencia en mi comunidad.;Empoderamiento;14-09-2014 8:30;CommunityLeader;Twitter;#Empoderamiento #Comunidad;15;30;Reino Unido;2014;9;14;8
117;119;Compasin en accin: apoyar un evento benfico local.;Neutral;18-07-2015 14:20;CharitySupporter;Instagram;#Compasin #EventoCaritativo;18;35;Canad;2015;7;18;14
118;120;Un momento de ternura, de conexin con los seres queridos.;Ternura;23-02-2016 19:45;LovingHeart;Facebook;#Ternura #TiempoEnFamilia;25;50;Reino Unido;2016;2;23;19
119;121;Excitacin de emocin mientras espero un anuncio especial.;Excitacin;30-10-2017 11:30;ExcitementFan;Twitter;#Excitacin #Emocin;20;40;Australia;2017;10;30;11
120;122;Sumergirse con entusiasmo en un nuevo proyecto.;Entusiasmo;15-06-2018 16:00;ProjectEnthusiast;Instagram;#Entusiasmo #NuevoProyecto;15;30;EE.UU;2018;6;15;16
121;123;Sentir una sensacin de plenitud despus de alcanzar un hito.;Cumplimiento;28-03-2019 18:20;MilestoneAchiever;Facebook;#Cumplimiento #Hito;22;45;India;2019;3;28;18
122;124;Reverencia por la belleza de un monumento histrico.;Reverencia;11-11-2019 15:00;HistoryLover;Twitter;#Reverencia #Historia;18;35;Reino Unido;2019;11;11;15
123;125;Euforia tras una reunin sorpresa con viejos amigos.;Euforia;02-04-2020 9:30;JoyfulReunion2;Instagram;#Euforia #OldFriends;25;50;Canad;2020;4;2;9
124;126;La euforia de un concierto de msica en vivo bajo las estrellas.;Euforia;19-06-2021 14:45;MusicEnthusiast;Facebook;#Euforia #MsicaEnVivo;15;30;EE.UU;2021;6;19;14
125;127;Contentamiento en la sencillez de un domingo tranquilo.;Neutral;15-08-2010 10:00;SimpleJoys;Twitter;#Alegra #Estado de nimo dominical;30;60;Australia;2010;8;15;10
126;128;Serenidad encontrada en las pginas de un libro favorito.;Neutral;22-09-2011 19:30;BookLover3;Instagram;#Serenidad #TiempoDeLibro;22;45;Reino Unido;2011;9;22;19
127;129;Agradecimiento por el apoyo recibido en momentos difciles.;Positivo;10-03-2012 8:30;SupportiveFriend;Facebook;#Gratitud #Apoyo;15;30;India;2012;3;10;8
128;130;Esperanzado sobre las posibilidades de un nuevo viaje.;Esperanza;05-12-2013 16:00;JourneyOptimist;Twitter;#Esperanza #NuevosComienzos;18;35;Canad;2013;12;5;16
129;131;Empoderamiento a travs del aprendizaje y el crecimiento personal.;Empoderamiento;20-07-2014 11:30;GrowthSeeker;Instagram;#Empoderamiento #CrecimientoPersonal;25;50;EE.UU;2014;7;20;11
130;132;Compasin hacia los necesitados durante las vacaciones.;Neutral;22-12-2015 14:20;HolidayHelper;Facebook;#Compasin #Apoyo Navideo;18;35;EE.UU;2015;12;22;14
131;133;Ternura en el calor de una acogedora tarde de invierno.;Ternura;10-02-2016 19:45;WinterWarmth;Twitter;#Ternura #Tarde Acogedora;25;50;Reino Unido;2016;2;10;19
132;134;Excitacin de emocin por una prxima aventura.;Excitacin;30-04-2017 11:30;AdventureAwaits;Instagram;#Excitacin #TiempodeAventura;20;40;Australia;2017;4;30;11
133;135;Entusiasmo por un proyecto creativo en ciernes.;Entusiasmo;15-09-2018 16:00;CreativeSpirit;Facebook;#Entusiasmo #Creatividad;15;30;Canad;2018;9;15;16
134;136;Cumplimiento al completar una rutina de ejercicios desafiante.;Cumplimiento;28-06-2019 18:20;FitnessAchiever;Twitter;#Cumplimiento #MetasFitness;22;45;India;2019;6;28;18
135;137;Reverencia por el arte exhibido en un museo.;Reverencia;11-11-2020 15:00;ArtAppreciator;Instagram;#Reverencia #ApreciacindelArte;18;35;Reino Unido;2020;11;11;15
136;138;Euforia despus de lograr una meta personal.;Euforia;02-03-2021 9:30;GoalAchiever2;Facebook;#Euforia #LogroPersonal;25;50;EE.UU;2021;3;2;9
137;139;Euforia por descubrir una joya escondida en la ciudad.;Euforia;18-02-2012 14:30;UrbanExplorer2;Twitter;#Euforia #GemaEscondida;20;40;EE.UU;2012;2;18;14
138;140;La euforia de una celebracin sorpresa de cumpleaos.;Euforia;05-11-2018 21:45;BirthdayJoy;Instagram;#Euforia #CumpleaosSorpresa;15;30;Reino Unido;2018;11;5;21
139;141;Satisfaccin ante la sencillez de una comida casera.;Neutral;12-09-2015 13:20;HomeChef;Facebook;#Alegra #CocinaEnCasa;25;50;India;2015;9;12;13
140;142;Serenidad encontrada en la meloda de un piano tranquilo.;Neutral;30-07-2016 18:10;MusicLover4;Twitter;#Serenidad #Meloda Pacfica;18;35;Canad;2016;7;30;18
141;143;Gratitud por la comunidad de apoyo que me rodea.;Gratitud;20-04-2013 10:30;CommunityLove;Instagram;#Gratitud #ApoyoComunitario;30;60;EE.UU;2013;4;20;10
142;144;Esperanzado sobre las perspectivas de una nueva empresa comercial.;Esperanza;08-12-2017 19:15;EntrepreneurHope;Facebook;#Esperanza #EmpresaEmpresaria;22;45;Canad;2017;12;8;19
143;145;Empoderamiento a travs de la mentora y gua de otros.;Empoderamiento;03-06-2014 8:20;MentorEmpower;Twitter;#Empoderamiento #Tutora;15;30;Reino Unido;2014;6;3;8
144;146;Compasin mostrada a travs de actos de bondad en la comunidad.;Neutral;15-01-2019 14:50;KindnessInAction;Instagram;#Compasin #Bondad Comunitaria;18;35;Australia;2019;1;15;14
145;147;Ternura en un mensaje sentido a un ser querido.;Ternura;25-12-2016 19:30;LoveExpress;Facebook;#Ternura #NotaDeAmor;25;50;Reino Unido;2016;12;25;19
146;148;Excitacin de emocin ante un viaje tan esperado.;Excitacin;10-03-2018 9:45;TravelExcitement;Twitter;#Excitacin #ViajeAventura;20;40;India;2018;3;10;9
147;149;Entusiasmo por un nuevo proyecto artstico en proceso.;Entusiasmo;17-09-2020 16:30;ArtisticSpirit;Instagram;#Entusiasmo #ProyectoArtstico;15;30;EE.UU;2020;9;17;16
148;150;Sentir una sensacin de realizacin despus de ayudar a los dems.;Cumplimiento;28-08-2011 18:45;HelperHeart;Facebook;#Realizacin #AyudandoAOtros;22;45;Canad;2011;8;28;18
149;151;Reverencia por el significado histrico de un hito.;Reverencia;01-11-2017 15:30;HistoryBuff;Twitter;#Reverencia #SitioHistrico;18;35;Australia;2017;11;1;15
150;152;Euforia despus de alcanzar un hito en el fitness.;Euforia;15-06-2019 10:00;FitnessAchiever2;Instagram;#Euforia #FitnessMilestone;25;50;Reino Unido;2019;6;15;10
151;153;La euforia del lanzamiento exitoso de un producto.;Euforia;03-04-2022 11:45;ProductLaunchJoy;Facebook;#Euforia #xitoLanzamientoProducto;15;30;EE.UU;2022;4;3;11
152;154;Satisfaccin en el abrazo de un ser querido.;Neutral;12-11-2010 20:20;LovingEmbrace;Twitter;#contento #amor;30;60;India;2010;11;12;20
153;155;Serenidad que se encuentra en la belleza de un atardecer junto al mar.;Neutral;22-07-2011 18:30;SunsetWatcher2;Instagram;#Serenidad #Vistas del atardecer;22;45;Canad;2011;7;22;18
154;156;Gratitud por las pequeas alegras que trae cada da.;Gratitud;30-03-2012 11:20;JoyfulHeart2;Facebook;#Gratitud #PequeasAlegras;15;30;Australia;2012;3;30;11
155;157;Esperanzado en el potencial de crecimiento personal.;Esperanza;05-10-2013 16:40;GrowthOptimist;Twitter;#Esperanza #DesarrolloPersonal;18;35;Reino Unido;2013;10;5;16
156;158;Empoderamiento a travs del aprendizaje de una nueva habilidad.;Empoderamiento;10-07-2014 13:15;SkillEmpower;Instagram;#Empoderamiento #ConstruccindeHabilidades;25;50;India;2014;7;10;13
157;159;Compasin al ofrecerse como voluntario para una organizacin benfica local.;Neutral;18-12-2015 14:20;CharityVolunteer;Facebook;#Compasin #TrabajoVoluntario;18;35;EE.UU;2015;12;18;14
158;160;Ternura en un momento de tranquilidad compartido con una mascota.;Ternura;10-02-2016 19:45;PetLove;Twitter;#Ternura #AmorDeMascota;25;50;Canad;2016;2;10;19
159;161;Despertar de entusiasmo por un prximo festival.;Excitacin;25-09-2017 11:30;FestivalFan;Instagram;#Excitacin #EmocinFestival;20;40;Reino Unido;2017;9;25;11
160;162;Entusiasmo por un proyecto de mejoras para el hogar de bricolaje.;Entusiasmo;15-04-2018 16:00;DIYEnthusiast;Facebook;#Entusiasmo #Mejoradelhogar;15;30;Australia;2018;4;15;16
161;163;Cumplimiento al completar un rompecabezas desafiante.;Cumplimiento;28-11-2019 18:20;PuzzleMaster;Twitter;#Cumplimiento #PuzzleChallenge;22;45;India;2019;11;28;18
162;164;Reverencia por las maravillas de la naturaleza en una ruta de senderismo.;Reverencia;11-05-2020 15:00;NatureAdmirer;Instagram;#Reverencia #ExploracinDeLaNaturaleza;18;35;EE.UU;2020;5;11;15
163;165;Euforia tras un reencuentro sorpresa con un amigo de la infancia.;Euforia;05-02-2021 9:30;ChildhoodJoy;Facebook;#Euforia #ReuninDeAmistad;25;50;Canad;2021;2;5;9
164;166;Sufriendo de desesperacin tras otro revs.;Desesperacin;10-03-2021 8:30;StrugglingSoul;Twitter;#Desesperacin #Lucha;5;10;EE.UU;2021;3;10;8
165;167;Abrumado por el dolor, extraando profundamente a un ser querido.;Dolor;05-07-2022 15:45;MourningHeart;Instagram;#Duelo #Prdida;8;15;Canad;2022;7;5;15
166;168;La soledad aparece a medida que la noche se vuelve ms fra.;Neutral;18-11-2019 21:20;SolitarySoul;Facebook;#Soledad #Aislamiento;10;20;Reino Unido;2019;11;18;21
167;169;Los celos me consumen al ser testigo del xito de los dems.;Negativo;12-08-2020 11:30;EnviousObserver;Twitter;#Celos #Envidia;12;25;India;2020;8;12;11
168;170;El resentimiento se acumula por traiciones pasadas.;Resentimiento;22-05-2018 14:45;BitterHeart;Instagram;#Resentimiento #Amargura;7;15;Australia;2018;5;22;14
169;171;La frustracin aumenta a medida que los obstculos bloquean mi camino.;Frustracin;30-01-2017 16:10;BlockedGoals;Facebook;#Frustracin #Obstculos;10;20;EE.UU;2017;1;30;16
170;172;Llega el aburrimiento, el da se siente infinitamente aburrido.;Aburrimiento;28-09-2016 19:45;BoredMind;Twitter;#Aburrimiento #FaltaDeInters;8;15;Canad;2016;9;28;19
171;173;La ansiedad se apodera de mi corazn, la preocupacin nubla mis pensamientos.;Ansiedad;15-04-2019 9:00;WorriedMind;Instagram;#Ansiedad #Preocupacin;12;25;Reino Unido;2019;4;15;9
172;174;Intimidacin por el futuro desconocido que se avecina.;Intimidacin;03-12-2021 18:30;FearfulSoul;Facebook;#Intimidacin #Miedo;15;30;India;2021;12;3;18
173;175;La impotencia se hunde a medida que los desafos se acumulan.;Neutral;20-06-2020 14:20;OverwhelmedHeart;Twitter;#Impotencia #Abrumado;8;15;Australia;2020;6;20;14
174;176;La envidia me devora cuando veo la prosperidad de los dems.;Envidia;07-11-2018 11:30;CovetousMind;Instagram;#Envidia #Deseo;10;20;Canad;2018;11;7;11
175;177;El arrepentimiento por las oportunidades perdidas atormenta mis pensamientos.;Arrepentimiento;25-08-2017 16:00;RemorsefulSoul;Facebook;#Arrepentimiento #OportunidadesPerdidas;12;25;Reino Unido;2017;8;25;16
176;178;Asco ante la visin de la injusticia y la crueldad.;Asco;11-02-2019 9:45;DisgustedHeart;Twitter;#Asgusto #Injusticia;7;15;India;2019;2;11;9
177;179;Ahogndome en la desesperacin, la esperanza se escapa entre mis dedos.;Negativo;02-04-2016 20:20;HopelessHeart;Instagram;#Desesperacin #Sinesperanza;10;20;EE.UU;2016;4;2;20
178;180;El dolor pesa mucho, desgarra a un compaero constante.;Dolor;18-10-2015 15:30;TearfulSoul;Facebook;#Duelo #Lgrimas;12;25;Canad;2015;10;18;15
179;181;Soledad en una habitacin llena de gente, un grito silencioso de conexin.;Soledad;12-07-2019 18:10;IsolatedMind;Twitter;#Soledad #BuscandoConexin;15;30;Reino Unido;2019;7;12;18
180;182;Los celos corroen mi confianza, una emocin txica.;Negativo;03-06-2018 16:30;SelfDoubt;Instagram;#Celos #Inseguridad;8;15;India;2018;6;3;16
181;183;El resentimiento crece, envenena las relaciones.;Resentimiento;15-01-2022 12:00;BrokenTrust;Facebook;#Resentimiento #Confianza Rota;10;20;Australia;2022;1;15;12
182;184;La frustracin se desborda, una erupcin volcnica de emociones.;Frustracin;10-04-2017 14:45;ExplosiveMind;Twitter;#Frustracin #ArrebatoEmocional;12;25;EE.UU;2017;4;10;14
183;185;El aburrimiento se asienta como polvo, la vida parece mundana.;Aburrimiento;28-11-2016 19:00;MundaneHeart;Instagram;#Aburrimiento #Monotona;7;15;Canad;2016;11;28;19
184;186;La ansiedad se apodera de mi pecho, un control implacable de mis pensamientos.;Ansiedad;05-09-2018 9:30;RestlessMind;Facebook;#Ansiedad #Inquietud;10;20;Reino Unido;2018;9;5;9
185;187;Intimidado por los desafos que se avecinan, el miedo se apodera de nosotros.;Intimidacin;22-10-2021 18:30;FearfulJourney;Twitter;#Intimidacin #EnfrentandoElMiedo;15;30;India;2021;10;22;18
186;188;La impotencia me envuelve, ahogndome en un mar de problemas.;Negativo;08-05-2019 14:20;OverwhelmedSoul;Instagram;#Impotencia #Luchando;8;15;Australia;2019;5;8;14
187;189;La envidia envenena mis pensamientos, codiciando el xito de los dems.;Envidia;20-03-2017 11:30;GreenEyedMonster;Facebook;#Envidia #xito;10;20;Canad;2017;3;20;11
188;190;Arrepentimiento por decisiones que llevaron a un presente doloroso.;Arrepentimiento;15-12-2018 16:00;RegretfulMind;Twitter;#Arrepentimiento #DecisionesPasadas;12;25;EE.UU;2018;12;15;16
189;191;Asco ante la corrupcin que mancha a la sociedad.;Asco;01-07-2016 9:45;CorruptedHeart;Instagram;#Asco #Corrupcin;7;15;Reino Unido;2016;7;1;9
190;192;Hundindome en la desesperacin, cada da ms oscuro que el anterior.;Desesperacin;20-08-2020 20:20;DrowningSoul;Facebook;#Desesperacin #DasOscuros;10;20;India;2020;8;20;20
191;193;El dolor abruma, una tormenta de emociones en su interior.;Dolor;25-02-2021 15:30;StormyHeart;Twitter;#Duelo #TormentaEmocional;12;25;Canad;2021;2;25;15
192;194;La soledad resuena en los espacios vacos, el anhelo de conexin.;Neutral;12-09-2019 18:10;EchoingSoul;Instagram;#Soledad #AnheloDeConexin;15;30;Australia;2019;9;12;18
193;195;Los celos envenenan mis pensamientos, el resentimiento se gesta en mi interior.;Negativo;05-08-2018 16:30;PoisonedMind;Facebook;#Celos #Resentimiento;8;15;EE.UU;2018;8;5;16
194;196;El resentimiento se pudre, una herida que se niega a sanar.;Resentimiento;12-01-2017 12:00;UnforgivingSoul;Twitter;#Resentimiento #Imperdonable;10;20;India;2017;1;12;12
195;197;La frustracin aumenta, una tormenta de emociones.;Frustracin;05-04-2022 14:45;ThunderingMind;Instagram;#Frustracin #ArrebatoEmocional;12;25;Reino Unido;2022;4;5;14
196;198;El aburrimiento persiste, un charco estancado de indiferencia.;Aburrimiento;02-10-2021 19:00;StagnantHeart;Facebook;#Aburrimiento #Estancamiento;7;15;Canad;2021;10;2;19
197;199;Embarcarse en un viaje de descubrimiento, impulsado por la curiosidad y la sed de conocimiento.;Curiosidad;15-04-2023 10:15;InquisitiveMind;Twitter;#Curiosidad #Aprendizaje;15;30;EE.UU;2023;4;15;10
198;200;Perdida en el vasto mar de informacin, una ola indiferente en el ocano digital.;Negativo;28-11-2022 17:30;ApatheticObserver;Instagram;#Indiferencia #SobrecargaDigital;7;15;Canad;2022;11;28;17
199;201;El complejo rompecabezas de la vida me deja en un estado de perpetua confusin, buscando respuestas en el caos.;Neutral;02-04-2020 9:45;SeekingClarity;Facebook;#Confusin #RompecabezasDeLaVida;10;20;Reino Unido;2020;4;2;9
200;202;Un entumecimiento se apodera de m, un escudo contra las emociones abrumadoras que la vida me arroja.;Entumecimiento;10-08-2021 14:00;EmotionallyDistant;Twitter;#Entumecimiento #EscudoEmocional;8;15;India;2021;8;10;14
201;203;Contemplar el atardecer, un anhelo melanclico por momentos que se escapan de los dedos del tiempo.;Melancola;18-06-2019 20:45;SunsetDreamer;Instagram;#Melancola #MomentosdelAtardecer;12;25;Australia;2019;6;18;20
202;204;Revisando fotografas antiguas, atrapadas en el abrazo de la sinfona agridulce de la nostalgia.;Neutral;05-02-2018 15:15;MemoryLaneTraveler;Facebook;#Nostalgia #CarrilDeLaMemoria;10;20;EE.UU;2018;2;5;15
203;205;Dividido entre emociones encontradas, una ambivalencia que pinta mis decisiones en tonos de incertidumbre.;Ambivalencia;30-05-2022 11:30;MixedFeelings;Twitter;#Ambivalencia #EleccionesInciertas;12;25;Canad;2022;5;30;11
204;206;Abrazar el flujo y reflujo de la vida, encontrar aceptacin en la danza de la existencia.;Positivo;10-01-2023 16:20;ZenLifestyle;Instagram;#Aceptacin #ViajeDeVida;15;30;Reino Unido;2023;1;10;16
205;207;Enfrentar los desafos de frente, una determinacin que alimenta el fuego interior para lograr lo imposible.;Determinacin;18-09-2020 13:45;ResilientSpirit;Facebook;#Determinacin #LograLoImposible;10;20;India;2020;9;18;13
206;208;Serenidad encontrada en la quietud de la naturaleza, un retiro tranquilo del caos del mundo moderno.;Neutral;03-07-2021 19:00;NatureSoul;Twitter;#Serenidad #RetiroDeNaturaleza;12;25;Australia;2021;7;3;19
207;209;La curiosidad me lleva por la madriguera del conocimiento, un perpetuo estudiante en el aula de la vida.;Curiosidad;08-10-2022 8:15;EternalLearner;Instagram;#Curiosidad #BsquedaDeConocimiento;20;40;EE.UU;2022;10;8;8
208;210;Flotando durante el da con un aire de indiferencia, alejado de los acontecimientos mundanos que suceden a su alrededor.;Neutral;22-03-2023 16:30;AloofObserver;Facebook;#Indiferencia #FlotandoPorLaVida;10;20;Canad;2023;3;22;16
209;211;Enredado en la red de pensamientos, reina la confusin mientras navego por el laberinto de las ideas.;Neutral;15-05-2021 11:45;ThoughtExplorer;Twitter;#Confusin #LaberintodelPensamiento;15;30;Reino Unido;2021;5;15;11
210;212;Entumecido ante el caos, las emociones encerradas, una fachada estoica que oculta la agitacin interior.;Entumecimiento;28-12-2019 14:30;StoicSoul;Instagram;#Entumecimiento #FachadaEstoica;8;15;Australia;2019;12;28;14
211;213;Susurros de melancola en la brisa, una conversacin silenciosa con ecos de sueos olvidados.;Melancola;01-03-2020 19:00;DreamerInSilence;Facebook;#Melancola #SusurrosEnLaBreeze;12;25;India;2020;3;1;19
212;214;Tropezar con un viejo diario, la nostalgia inundndome en oleadas, llevndome a momentos lejanos.;Neutral;10-07-2018 15:45;JournalKeeper;Twitter;#Nostalgia #MomentosDeDiario;10;20;Canad;2018;7;10;15
213;215;Un tapiz de sentimientos encontrados que se tejen a travs de la incertidumbre, atrapados en los hilos de la ambivalencia.;Ambivalencia;05-01-2022 10:30;ThreadWeaver;Instagram;#Ambivalencia #SentimientosConflictivos;12;25;Reino Unido;2022;1;5;10
214;216;Abrazar los defectos, encontrar aceptacin en la imperfeccin, un viaje hacia el amor propio.;Aceptacin;20-08-2021 16:20;SelfLoveAdvocate;Facebook;#Aceptacin #ViajeDeAmorPropio;15;30;Australia;2021;8;20;16
215;217;La determinacin arde como la plvora, superando obstculos, convirtiendo los sueos en realidad.;Determinacin;03-11-2019 13:45;DreamChaser;Twitter;#Determinacin #SueosEnRealidad;18;35;EE.UU;2019;11;3;13
216;218;Momentos tranquilos junto al ocano, serenidad inundndose, un retiro pacfico entre el abrazo de las olas.;Neutral;12-04-2020 19:30;OceanSoul;Instagram;#Serenidad #RetiroOcano;25;50;Canad;2020;4;12;19
217;219;Explorando nuevos horizontes con la chispa de la curiosidad, un aventurero en el vasto paisaje del conocimiento.;Curiosidad;15-04-2022 8:45;HorizonExplorer;Facebook;#Curiosidad #NuevosHorizontes;22;45;India;2022;4;15;8
218;220;Pasar el da con un comportamiento indiferente, abrazando el arte de la indiferencia.;Neutral;10-02-2023 17:00;NonchalantSpirit;Twitter;#Indiferencia #DerivandoPorLaVida;9;18;Reino Unido;2023;2;10;17
219;221;Luchando con pensamientos, una mente perpleja perdida en el laberinto de las complejidades de la vida.;Neutral;05-08-2020 12:15;ComplexThinker;Instagram;#Confusin #Mente Perpleja;14;28;Australia;2020;8;5;12
220;222;Inmerso en un estado de entumecimiento emocional, un escudo contra la tormenta de las luchas cotidianas.;Entumecimiento;01-12-2021 15:30;ShieldedHeart;Facebook;#Entumecimiento #EscudoEmocional;10;20;EE.UU;2021;12;1;15
221;223;Una sinfona melanclica sonando de fondo, la banda sonora de un corazn melanclico.;Melancola;25-03-2019 21:00;SymphonySoul;Twitter;#Melancola #MelanclicoCorazn;13;26;Canad;2019;3;25;21
222;224;Hojeando las pginas de un viejo anuario, la nostalgia pinta sonrisas y lgrimas en mi rostro.;Neutral;18-06-2017 14:45;YearbookExplorer;Instagram;#Nostalgia #RecuerdosdelAnuario;12;25;India;2017;6;18;14
223;225;Dividido entre emociones opuestas, una ambivalencia que tie mis decisiones con matices de incertidumbre.;Ambivalencia;08-07-2022 11:30;DecisiveDilemma;Facebook;#Ambivalencia #SombrasDeIncertidumbre;15;30;Australia;2022;7;8;11
224;226;Abrazar las imperfecciones de la vida, encontrar aceptacin en el viaje, con cicatrices y todo.;Aceptacin;15-05-2023 16:20;ImperfectHarmony;Twitter;#Aceptacin #ViajeImperfecto;18;36;Canad;2023;5;15;16
225;227;Una determinacin ardiente arde en su interior, alimentada por la visin de alcanzar alturas incomparables.;Positivo;10-09-2021 14:45;VisionarySpirit;Instagram;#Determinacin #AlturasInigualables;20;40;Reino Unido;2021;9;10;14
226;228;Disfrutando de la serenidad de un bosque tranquilo, donde los susurros de la naturaleza traen paz al alma.;Serenidad;28-02-2020 18:30;ForestDreamer;Facebook;#Serenidad #SusurrosDeLaNaturaleza;25;50;EE.UU;2020;2;28;18
227;231;Indiferente al ruido del mundo, un observador silencioso en medio de la cacofona de la vida.;Neutral;10-03-2023 16:30;SilentSpectator;Instagram;#Indiferencia #ObservadorSilencioso;9;18;India;2023;3;10;16
228;232;Al navegar por el laberinto de los pensamientos, la confusin es una compaera constante en el laberinto de las ideas.;Neutral;02-05-2021 11:45;MazeNavigator;Facebook;#Confusin #LaberintodelPensamiento;14;28;Australia;2021;5;2;11
229;233;Un entumecimiento impenetrable me protege de las tormentas emocionales, una fortaleza de resiliencia estoica.;Entumecimiento;18-10-2019 14:30;ResilientFortress;Twitter;#Entumecimiento #ResilienciaEstoica;11;22;Reino Unido;2019;10;18;14
230;234;La melancola pinta el mundo con tonos de nostalgia, un lienzo de recuerdos agridulces.;Neutral;05-01-2020 20:00;CanvasDreamer;Instagram;#Melancola #RecuerdosAgridulces;13;26;EE.UU;2020;1;5;20
231;235;Un viaje al pasado, hojeando las pginas de un viejo diario, con la nostalgia a la cabeza.;Neutral;10-08-2018 15:45;DiaryExplorer;Facebook;#Nostalgia #ViajeDiario;12;25;Canad;2018;8;10;15
232;236;La ambivalencia nubla las decisiones, atrapados en la encrucijada de emociones encontradas.;Ambivalencia;15-01-2022 10:30;CrossroadsTraveler;Twitter;#Ambivalencia #EmocionesConflictivas;15;30;India;2022;1;15;10
233;237;Abrazar las imperfecciones, encontrar aceptacin en el mosaico del hermoso caos de la vida.;Aceptacin;20-07-2021 16:20;MosaicDreamer;Instagram;#Aceptacin #HermosoCaos;18;36;Australia;2021;7;20;16
234;238;La determinacin como fuerza motriz que me impulsa hacia adelante en el camino hacia logros extraordinarios.;Determinacin;03-12-2019 13:45;PathfinderSpirit;Facebook;#Determinacin #CaminoExtraordinario;20;40;EE.UU;2019;12;3;13
235;239;Buscando la serenidad en la meloda de las gotas de lluvia, un escape tranquilo del ruido de la vida cotidiana.;Serenidad;12-04-2020 19:30;RaindropHarmony;Twitter;#Serenidad #Meloda de la Gota de Lluvia;25;50;Canad;2020;4;12;19
236;240;Curiosidad que impulsa la exploracin de lo desconocido, buscador de conocimiento en territorios inexplorados.;Curiosidad;08-05-2022 8:45;SeekerOfUnknowns;Instagram;#Curiosidad #BuscadorDeConocimiento;22;45;Reino Unido;2022;5;8;8
237;241;Pasando el da con aire de indiferencia, indiferente a las trivialidades de la vida.;Neutral;22-02-2023 17:00;NonchalantWanderer;Facebook;#Indiferencia #DerivandoPorLaVida;9;18;India;2023;2;22;17
238;242;Perdido en el laberinto de pensamientos, la confusin arroja sombras sobre la bsqueda de la claridad.;Neutral;05-06-2020 12:15;ShadowedSeeker;Twitter;#Confusin #LaberintoDePensamientos;14;28;Australia;2020;6;5;12
239;243;Envuelto en el manto del entumecimiento emocional, un escudo contra las tormentas de la turbulencia de la vida.;Entumecimiento;30-11-2021 15:30;TurbulentShield;Instagram;#Entumecimiento #Tormentas Emocionales;10;20;Canad;2021;11;30;15
240;244;La melancola como compaera, pintando el lienzo de la vida con las pinceladas del anhelo melanclico.;Neutral;25-02-2019 21:00;WistfulPainter;Facebook;#Melancola #AnheloMelanclico;13;26;Reino Unido;2019;2;25;21
241;245;Hojeando las pginas de un viejo lbum de fotos, la nostalgia teje cuentos de risas y lgrimas.;Neutral;18-05-2017 14:45;TaleWeaver;Twitter;#Nostalgia #FotoAlbumHistorias;12;25;EE.UU;2017;5;18;14
242;246;Ambivalencia en el aire, atrapada entre la encrucijada de emociones y decisiones encontradas.;Neutral;05-08-2022 11:30;CrossroadsExplorer;Instagram;#Ambivalencia #EncrucijadaConfusin;15;30;Canad;2022;8;5;11
243;247;Abrazar la belleza de las imperfecciones, encontrar aceptacin en el mosaico del arte impredecible de la vida.;Aceptacin;15-06-2023 16:20;MosaicArtist;Facebook;#Aceptacin #ArteImpredecible;18;36;Australia;2023;6;15;16
244;248;Determinacin en llamas, forjando un camino a travs de desafos, esculpiendo sueos en realidades tangibles.;Determinacin;10-10-2021 14:45;DreamSculptor;Twitter;#Determinacin #EsculpiendoSueos;20;40;Reino Unido;2021;10;10;14
245;249;Sumrgete en la serenidad de una noche iluminada por la luna, donde los tranquilos susurros de la naturaleza traen paz al alma.;Serenidad;12-05-2020 19:30;MoonlitSoul;Instagram;#Serenidad #PazLuzDeLaLuna;25;50;EE.UU;2020;5;12;19
246;250;Impulsado por la curiosidad, se aventura en reinos inexplorados, un intrpido explorador de los misterios del mundo.;Curiosidad;01-12-2022 9:15;FearlessExplorer;Facebook;#Curiosidad #ExploradorSin Miedo;22;44;India;2022;12;1;9
247;251;Envuelto en el manto del entumecimiento emocional, un escudo contra las tormentas de la turbulencia de la vida.;Entumecimiento;30-11-2021 15:30;TurbulentShield;Instagram;#Entumecimiento #Tormentas Emocionales;10;20;Canad;2021;11;30;15
248;252;Bailando por la vida con la exuberancia de un espritu despreocupado, abrazando la alegra y el entusiasmo en cada paso.;nimo;12-07-2018 17:45;JoyfulDancer;Twitter;#Zest #EsprituDespreocupado;15;30;EE.UU;2018;7;12;17
249;253;Disfrutando del brillo dorado de la alegra, un ro sereno que fluye a travs del paisaje del corazn.;Neutral;05-09-2020 20:10;SereneBasker;Facebook;#Alegra #ResplandorDorado;18;36;Australia;2020;9;5;20
250;254;Mirando hacia el horizonte con ojos esperanzados, pintando un lienzo de sueos iluminados por el sol del optimismo.;Esperanza;18-04-2022 8:00;DreamPainter;Instagram;#Esperanza #CanvasOfDreams;12;24;India;2022;4;18;8
251;255;Erguido, orgulloso como un roble, las ramas del logro se extienden hacia el cielo del logro.;Orgullo;10-12-2019 12:20;OakAchiever;Twitter;#Orgulloso #RamasDeLogro;25;50;Canad;2019;12;10;12
252;256;Un corazn rebosante de gratitud, un jardn donde el aprecio florece en el suelo de la bondad y la conexin.;Agradecido;28-02-2023 9:45;HeartGardener;Facebook;#Grateful #BlossomingConnection;20;40;EE.UU;2023;2;28;9
253;257;Extendiendo una mano, hilos empticos tejiendo un tapiz de comprensin, abrazando las alegras y tristezas de los dems.;Emptico;03-04-2018 14:15;ThreadWeaver;Instagram;#Empathetic #TapestryOfUnderstanding;15;30;Reino Unido;2018;4;3;14
254;258;Nubes compasivas, cargadas de cuidados, que derraman empata sobre los terrenos ridos del sufrimiento humano.;Neutral;20-06-2022 10:30;CloudCaretaker;Twitter;#Compassionate #ShowerOfEmpathy;18;36;Australia;2022;6;20;10
255;259;Bailando juguetonamente bajo la lluvia de risas, un espritu caprichoso dando vueltas en los charcos de alegra y alegra.;Juguetn;08-07-2020 18:00;RainDancer;Facebook;#Juguetn #BaileBajoLaLluvia;22;44;Canad;2020;7;8;18
256;260;Volando sobre las alas de un espritu libre, libre de las cadenas del conformismo, pintando el cielo con independencia.;Neutral;15-08-2021 11:10;SkyPainter;Instagram;#EsprituLibre #PintandoElCielo;20;40;India;2021;8;15;11
257;261;Baado por el brillo de la inspiracin, un fnix creativo que surge de las cenizas de los pensamientos ordinarios para explorar nuevos reinos.;Inspirado;25-10-2019 16:50;PhoenixExplorer;Twitter;#Inspirado #CreativePhoenix;15;30;Reino Unido;2019;10;25;16
258;262;Navegando por el mar de la esperanza, navegando hacia el amanecer de las posibilidades, confiando en el barco de la anticipacin positiva.;Esperanza;05-10-2023 7:30;SunriseNavigator;Facebook;#Esperanza #AmanecerDePosibilidades;12;24;EE.UU;2023;10;5;7
259;263;Caminando con confianza, huellas de seguridad en s mismo impresas en las arenas de los desafos conquistados y las victorias reclamadas.;Confiado;15-02-2022 13:15;SandStrider;Instagram;#Confiado #HuellasDeSeguridad;25;50;Australia;2022;2;15;13
260;264;Perdido en la sinfona de la noche, una serenata iluminada por la luna que susurra historias de pasin por los viajes y sueos iluminados por la luna.;Neutral;08-05-2021 22:00;NightSerenader;Twitter;#Serenidad #Serenata A La Luz De La Luna;13;26;Canad;2021;5;8;22
261;265;Revelando las capas de curiosidad, un laberinto de preguntas que conducen a tesoros de conocimiento por descubrir.;Neutral;29-11-2020 14:45;KnowledgeSeeker;Instagram;#Curiosidad #LaberintoDePreguntas;17;34;EE.UU;2020;11;29;14
262;266;En el abrazo de la brisa otoal, hojas de ambivalencia bailando en un vals entre elecciones e incertidumbres.;Ambivalencia;14-09-2019 10:20;BreezeWaltzer;Facebook;#Ambivalencia #ValsOtoal;14;28;Reino Unido;2019;9;14;10
263;267;La gratitud como estrella gua, navegando por la constelacin de bendiciones en el vasto universo de los preciosos momentos de la vida.;Positivo;12-03-2022 19:55;StarNavigator;Twitter;#Grateful #GuidingStar;19;38;Australia;2022;3;12;19
264;268;Con el corazn entusiasmado, corriendo por campos de entusiasmo, persiguiendo rayos de sol y risas en los prados de la alegra.;nimo;30-03-2023 16:30;MeadowSprinter;Instagram;#Zest #CamposDeEntusiasmo;16;32;India;2023;3;30;16
265;269;Una lluvia compasiva, lgrimas de empata cayendo suavemente, alimentando las semillas de la bondad en el jardn de las conexiones humanas.;Neutral;01-07-2021 12:10;RainNurturer;Facebook;#Compasivo #LgrimasDeEmpata;21;42;Canad;2021;7;1;12
266;270;Escalando con orgullo las cimas de los logros, un alpinista conquistando desafos y plantando la bandera del xito.;Orgullo;05-01-2020 8:45;PeakConqueror;Twitter;#Proud #ScalingPeaks;23;46;EE.UU;2020;1;5;8
267;271;Abrazado por el amanecer Esperanza, un jardinero que siembra semillas de optimismo y cuida las flores de un maana ms brillante.;Esperanza;17-07-2022 6:15;DawnGardener;Instagram;#Esperanza #SemillasDeOptimismo;14;28;Reino Unido;2022;7;17;6
268;272;Una escapada ldica al carnaval de la vida, risas en carrusel y sueos de algodn de azcar arremolinndose en una atmsfera alegre.;Positivo;22-08-2018 17:20;CarnivalDreamer;Facebook;#EscapadaJuguetona #Carnaval;24;48;Australia;2018;8;22;17
269;273;Flotando sobre nubes de inspiracin, un artista pinta el cielo con pinceladas de creatividad, creando una obra maestra de sueos.;Inspirado;08-12-2021 14:30;SkyArtist;Twitter;#Inspiradas #NubesDeCreatividad;18;36;India;2021;12;8;14
270;274;Navegando por el ro de la alegra, un sereno crucero en barco por las tranquilas aguas de la paz interior y la aceptacin.;Neutral;27-04-2019 9:50;RiverNavigator;Instagram;#Alegra #AguasTranquilas;20;40;Canad;2019;4;27;9
271;275;Con la empata como linterna, deambulando por los oscuros callejones del dolor, iluminando el camino con compasin y cuidado.;Emptico;03-09-2023 21:40;LanternWanderer;Facebook;#Empathetic #LanternOfCompassion;16;32;EE.UU;2023;9;3;21
272;276;Un espritu libre que vuela en las alas de los sueos, dejando rastros de independencia en el cielo azul de posibilidades ilimitadas.;Positivo;10-06-2020 10:05;DreamSoarer;Twitter;#EsprituLibre #AlasDeSueos;22;44;Reino Unido;2020;6;10;10
273;277;Baado por los tonos dorados del agradecimiento, un atardecer de aprecio que proyecta su clido resplandor sobre los paisajes del corazn.;Agradecido;01-04-2022 18:30;SunsetAdmirer;Instagram;#Grateful #GoldenHues;19;38;Australia;2022;4;1;18
274;278;Pasos confiados en la danza de la vida, un saln de baile donde la seguridad en uno mismo conduce, girando a travs de los desafos con gracia.;Neutral;15-01-2021 13:00;DanceStrider;Facebook;#Confiado #DanzaDeLaVida;23;46;Canad;2021;1;15;13
275;279;Susurros Esperanzaes del viento, que llevan las promesas de un maana ms brillante, una sinfona de optimismo en el aire de posibilidades.;Esperanza;06-05-2023 7:20;WindWhisperer;Twitter;#Esperanza #MaanasMsBrillantes;15;30;India;2023;5;6;7
276;280;Jugando a hacer malabarismos con las responsabilidades, un artista de circo equilibrando los actos de trabajo y alegra, lanzando risas al aire.;Juguetn;18-11-2019 15:15;JugglingArtist;Instagram;#Juguetn #MalabarismoResponsabilidades;25;50;EE.UU;2019;11;18;15
277;281;Susurrando historias de inspiracin a las estrellas, un narrador creando constelaciones a partir de los hilos de la imaginacin.;Inspirado;29-08-2020 20:45;StarStoryteller;Facebook;#Inspirado #CuentosALasEstrellas;14;28;Reino Unido;2020;8;29;20
278;282;Trazando un rumbo a travs de las olas de esperanzada anticipacin, un marinero navegando hacia las costas de sueos an inexplorados.;Esperanza;30-10-2022 11:40;WaveNavigator;Twitter;#Esperanza #SailorOfDreams;17;34;Australia;2022;10;30;11
279;283;Una lluvia compasiva, lgrimas de empata cayendo suavemente, alimentando las semillas de la bondad en el jardn de las conexiones humanas.;Neutral;01-07-2021 12:10;RainNurturer;Instagram;#Compasivo #LgrimasDeEmpata;21;42;Canad;2021;7;1;12
280;284;Nostalgia, un baile agridulce en el saln de baile de recuerdos preciados iluminado por la luna.;Orgullo;05-01-2020 8:45;PeakConqueror;Twitter;#Proud #ScalingPeaks;23;46;EE.UU;2020;1;5;8
281;285;Abrazado por el amanecer Esperanza, un jardinero que siembra semillas de optimismo y cuida las flores de un maana ms brillante.;Esperanza;17-07-2022 6:15;DawnGardener;Instagram;#Esperanza #SemillasDeOptimismo;14;28;Reino Unido;2022;7;17;6
282;286;Una escapada ldica al carnaval de la vida, risas en carrusel y sueos de algodn de azcar arremolinndose en una atmsfera alegre.;Positivo;22-08-2018 17:20;CarnivalDreamer;Facebook;#EscapadaJuguetona #Carnaval;24;48;Australia;2018;8;22;17
283;287;Flotando sobre nubes de inspiracin, un artista pinta el cielo con pinceladas de creatividad, creando una obra maestra de sueos.;Inspirado;08-12-2021 14:30;SkyArtist;Twitter;#Inspiradas #NubesDeCreatividad;18;36;India;2021;12;8;14
284;288;Navegando por el ro de la alegra, un sereno crucero en barco por las tranquilas aguas de la paz interior y la aceptacin.;Neutral;27-04-2019 9:50;RiverNavigator;Instagram;#Alegra #AguasTranquilas;20;40;Canad;2019;4;27;9
285;289;Con la empata como linterna, deambulando por los oscuros callejones del dolor, iluminando el camino con compasin y cuidado.;Emptico;03-09-2023 21:40;LanternWanderer;Facebook;#Empathetic #LanternOfCompassion;16;32;EE.UU;2023;9;3;21
286;290;Un espritu libre que vuela en las alas de los sueos, dejando rastros de independencia en el cielo azul de posibilidades ilimitadas.;Neutral;10-06-2020 10:05;DreamSoarer;Twitter;#EsprituLibre #AlasDeSueos;22;44;Reino Unido;2020;6;10;10
287;291;Baado por los tonos dorados del agradecimiento, un atardecer de aprecio que proyecta su clido resplandor sobre los paisajes del corazn.;Agradecido;01-04-2022 18:30;SunsetAdmirer;Instagram;#Grateful #GoldenHues;19;38;Australia;2022;4;1;18
288;292;Pasos confiados en la danza de la vida, un saln de baile donde la seguridad en uno mismo conduce, girando a travs de los desafos con gracia.;Neutral;15-01-2021 13:00;DanceStrider;Facebook;#Confiado #DanzaDeLaVida;23;46;Canad;2021;1;15;13
289;293;Susurros Esperanzadores del viento, que llevan las promesas de un maana ms brillante, una sinfona de optimismo en el aire de posibilidades.;Esperanza;06-05-2023 7:20;WindWhisperer;Twitter;#Esperanza #MaanasMsBrillantes;15;30;India;2023;5;6;7
290;294;Jugando a hacer malabarismos con las responsabilidades, un artista de circo equilibrando los actos de trabajo y alegra, lanzando risas al aire.;Juguetn;18-11-2019 15:15;JugglingArtist;Instagram;#Juguetn #MalabarismoResponsabilidades;25;50;USA;2019;11;18;15
291;295;Susurrando historias de inspiracin a las estrellas, un narrador creando constelaciones a partir de los hilos de la imaginacin.;Inspirado;29-08-2020 20:45;StarStoryteller;Facebook;#Inspirado #CuentosALasEstrellas;14;28;Reino Unido;2020;8;29;20
292;296;Trazando un rumbo a travs de las olas de esperanzada anticipacin, un marinero navegando hacia las costas de sueos an inexplorados.;Esperanza;30-10-2022 11:40;WaveNavigator;Twitter;#Esperanza #SailorOfDreams;17;34;Australia;2022;10;30;11
293;297;Una lluvia compasiva, lgrimas de empata cayendo suavemente, alimentando las semillas de la bondad en el jardn de las conexiones humanas.;Neutral;01-07-2021 12:10;RainNurturer;Instagram;#Compasivo #LgrimasDeEmpata;21;42;Canad;2021;7;1;12
294;298;Escalando con orgullo las cimas de los logros, un alpinista conquistando desafos y plantando la bandera del xito.;Orgullo;05-01-2020 8:45;PeakConqueror;Twitter;#Proud #ScalingPeaks;23;46;EE.UU;2020;1;5;8
295;299;Abrazado por el amanecer Esperanza, un jardinero que siembra semillas de optimismo y cuida las flores de un maana ms brillante.;Esperanza;17-07-2022 6:15;DawnGardener;Instagram;#Esperanza #SemillasDeOptimismo;14;28;India;2022;7;17;6
296;300;Una escapada ldica al carnaval de la vida, risas en carrusel y sueos de algodn de azcar arremolinndose en una atmsfera alegre.;Positivo;22-08-2018 17:20;CarnivalDreamer;Facebook;#EscapadaJuguetona #Carnaval;24;48;Australia;2018;8;22;17
297;301;Ahogndose en el abismo de la desesperacin, un corazn hecho aicos, perdido en el silencio resonante de la desesperanza.;Negativo;15-09-2021 16:00;ShatteredHeart;Instagram;#Desesperacin #Haciendo eco del silencio;8;16;Canad;2021;9;15;16
298;302;La amargura se pudre como una enredadera venenosa, entrelaza el alma en una red de resentimiento, envenena el jardn de la paz.;Amargura;08-03-2019 14:20;VenomousSoul;Facebook;#Amargura #ResentimientoWeb;12;24;Reino Unido;2019;3;8;14
299;303;Vagando por el desierto de la soledad, cada paso es un profundo suspiro, espejismos de conexin que brillan pero nunca se materializan.;Soledad;20-07-2017 11:45;DesertWanderer;Twitter;#Soledad #EspejismosDeConexin;15;30;EE.UU;2017;7;20;11
300;304;Anhelo de un toque que no est ah, ecos de una calidez distante que rondan el corazn en el fro abrazo de la soledad.;Anhelo;02-11-2020 19:30;ColdEmbrace;Instagram;#Anhelo #Calor lejano;10;20;Australia;2020;11;2;19
301;305;Ojos bien abiertos en la noche, sombras aterradoras bailando en las paredes, la mente prisionera de horrores imaginados.;Temeroso;12-05-2022 2:00;NightPrisoner;Facebook;#Temerosos #HorroresImaginados;18;36;India;2022;5;12;2
302;306;Pasos aprensivos sobre la cuerda floja de la incertidumbre, un acto de equilibrio donde la cada parece inevitable, la ansiedad una compaera constante.;Negativo;08-04-2023 13:15;TightropeWalker;Twitter;#Aprensivo #ActodeEquilibrio;14;28;Reino Unido;2023;4;8;13
303;307;Abrumado por el peso del mundo, Atlas con los hombros temblorosos, cada responsabilidad una roca en el paisaje del cansancio.;Abrumado;25-06-2021 17:50;AtlasBearer;Instagram;#Abrumado #BouldersOfExhaustion;22;44;Canad;2021;6;25;17
304;308;Los celos, un monstruo de ojos verdes, acechando en las sombras, arrojando una nube oscura sobre el sol del xito de los dems.;Negativo;30-08-2019 10:10;GreenMonster;Facebook;#Celoso #MonstruoDeOjosVerdes;16;32;EE.UU;2019;8;30;10
305;309;Devastado por la tormenta de la traicin, los restos de la confianza se dispersaron como escombros, un corazn desgarrado por los vientos de las promesas incumplidas.;Devastado;03-08-2022 15:30;StormSurvivor;Twitter;#Devastado #VientosDePromesasRotas;25;50;Australia;2022;8;3;15
306;310;Dedos frustrados golpeando el teclado, una sinfona de molestia que compone un rompecabezas irresoluble de expectativas incumplidas.;Frustrado;17-12-2020 9:20;PuzzleComposer;Instagram;#Frustrado #RompecabezasIrresoluble;12;24;India;2020;12;17;9
307;311;Ojos envidiosos fijos en el premio dorado, una angustia alimentada por el doloroso deseo de posesiones que parecen estar siempre fuera de su alcance.;Envidioso;28-02-2021 22:45;GildedHeartache;Facebook;#Envidioso #PremioDorado;20;40;EE.UU;2021;2;28;22
308;312;Miradas desdeosas, una fortaleza construida con indiferencia, muros impenetrables a las splicas de comprensin y reconocimiento.;Neutral;10-05-2018 14:00;IndifferentFort;Twitter;#Despreciativo #MurosImpenetrables;14;28;Reino Unido;2018;5;10;14
309;313;Los sueos destrozados yacen en el suelo como fragmentos de vidrio, un mosaico de decepcin elaborado por las manos de la frustracin.;Frustrado;07-01-2022 11:10;DreamMosaic;Instagram;#Frustrado #MosaicoDeDecepcin;15;30;Canad;2022;1;7;11
310;314;La soledad, una compaera silenciosa en la noche, el nico eco en la cmara de la soledad, el nocturno solitario de un corazn.;Neutral;19-09-2019 3:30;NocturnalEcho;Facebook;#Soledad #NocturnoSolitario;18;36;Australia;2019;9;19;3
311;315;Susurros temerosos en la oscuridad, la mente atormentada por el espectro de lo desconocido, sombras bailando al ritmo de la meloda de la ansiedad.;Temeroso;14-07-2023 23:00;DarkWhispers;Twitter;#Fearful #SpecterOfTheUnknown;13;26;Reino Unido;2023;7;14;23
312;316;Amargura, un regusto Amargura que persiste en la lengua, cada palabra un recordatorio de heridas que se niegan a sanar con el paso del tiempo.;Amargura;05-04-2020 16:20;LingeringTaste;Instagram;#Amargura #ResaborAmargura;10;20;India;2020;4;5;16
313;317;Abrumado por la cacofona de las expectativas, un alma ahogada en la tempestad de presin, luchando por mantenerse a flote.;Abrumado;29-11-2021 8:45;TempestSurvivor;Facebook;#Abrumado #AhogandoAlma;20;40;EE.UU;2021;11;29;8
314;318;Los celos, un veneno que se cuela por las venas, envenenando el corazn y convirtindolo en caldo de cultivo para el descontento.;Negativo;12-12-2019 17:00;VenomousHeart;Twitter;#Celoso #CoraznDeDescontento;16;32;Australia;2019;12;12;17
315;319;Devastada por la revelacin de la traicin, la confianza se hizo aicos como un frgil cristal, dejando fragmentos de dolor a su paso.;Devastado;20-05-2022 14:50;FragileTrust;Instagram;#Devastado #Confianza destrozada;25;50;Canad;2022;5;20;14
316;320;Intentos frustrados de reparar una conexin rota, los hilos de la comprensin se deslizan entre los dedos como granos de arena.;Frustrado;03-09-2020 12:15;BrokenThreads;Facebook;#Frustrado #DeslizndoseHilos;14;28;Reino Unido;2020;9;3;12
317;321;Miradas envidiosas puestas en el podio del xito, una pldora amarga tragada, el sabor persiste como un recordatorio constante de alturas no alcanzadas.;Envidia;10-02-2021 19:30;SuccessPill;Twitter;#Envidioso #PastillaAmarga;20;40;EE.UU;2021;2;10;19
318;322;Gestos desdeosos, un teln corrido para blindar la vulnerabilidad, un escenario donde las emociones pasan a un segundo plano ante la manifestacin de la indiferencia.;Despectivo;18-08-2018 14:40;CurtainShield;Instagram;#Desprecio #IndiferenciaActuacin;12;24;Australia;2018;8;18;14
319;323;La desesperacin es como una espesa niebla que envuelve cada pensamiento, desdibujando el camino que tenemos por delante, un viaje en el laberinto de la desesperanza absoluta.;Desesperacin;28-02-2022 21:00;FoggyLabyrinth;Facebook;#Desesperacin #LaberintoDeDesesperanza;8;16;Canad;2022;2;28;21
320;324;Amargura, un escalofro Amargura en el aire, congelando momentos en carmbanos de resentimiento que cuelgan precariamente sobre el paisaje de la memoria.;Amargura;15-10-2019 10:30;IcyResentment;Twitter;#Amargura #CarmbanosDeResentimiento;15;30;Reino Unido;2019;10;15;10
321;325;La soledad, una luna solitaria en un cielo sin estrellas, arrojando un resplandor fro sobre el paisaje del aislamiento, donde los ecos rebotan en los espacios vacos.;Neutral;01-12-2017 18:50;SolitaryMoon;Instagram;#Soledad #CieloSinEstrellas;18;36;EE.UU;2017;12;1;18
322;326;Anhelando el calor de un sol desaparecido, un dolor de corazn pintado con los tonos de una puesta de sol que nunca apareci en el horizonte.;Anhelo;18-04-2020 16:15;VanishedSunset;Facebook;#Anhelo #TonosDeAtardecer;10;20;Australia;2020;4;18;16
323;327;Ojos temerosos que escanean las sombras, prisionero de la noche, aterrorizado por los monstruos al acecho nacidos de los rincones ms oscuros de la mente.;Temeroso;07-01-2023 3:30;NightPrisoner;Twitter;#Temerosos #Monstruos al acecho;18;36;India;2023;1;7;3
324;328;Susurros aprensivos en el viento, un pronstico de incertidumbre, la veleta de la mente girando salvajemente en la tormenta de la duda.;Aprensivo;10-06-2021 10:00;WindWhisperer;Instagram;#Aprensivo #TormentaDeDuda;14;28;Canad;2021;6;10;10
325;329;Abrumado por el laberinto de expectativas, un minotauro de presin acecha en el laberinto, esperando devorar el espritu de resiliencia.;Abrumado;22-02-2020 15:20;MazeExplorer;Facebook;#Abrumado #MinotauroDePresin;22;44;EE.UU;2020;2;22;15
326;330;Los celos, una herida supurante, el dolor que se intensifica con cada mirada al jardn de los logros de los dems, que florece ms all de la valla.;Negativo;17-03-2018 14:45;WoundedGarden;Twitter;#Celoso #LogrosFlorecientes;16;32;Reino Unido;2018;3;17;14
327;331;Devastado, un corazn en ruinas, los ecos de sueos destrozados reverberando en las cmaras, un rquiem por lo que una vez estuvo completo.;Devastado;28-10-2022 11:15;RuinedHeart;Instagram;#Devastado #EcosDeSueosDestrozados;25;50;Australia;2022;10;28;11
328;332;Intentos frustrados de desenredar el nudo de la confusin, los hilos de la comprensin se deslizan ms hacia el laberinto de la falta de comunicacin.;Frustrado;01-11-2020 12:30;KnotUntangler;Facebook;#Frustrado #LaberintoDeMalcomunicacin;14;28;India;2020;11;1;12
329;333;Ojos envidiosos fijos en el cofre del tesoro de las oportunidades, una angustia alimentada por el deseo de llaves que parecen siempre esquivas.;Envidia;15-01-2021 22:10;ElusiveKeys;Twitter;#Envidioso #DeseoDeLlaves;20;40;EE.UU;2021;1;15;22
330;334;Gestos desdeosos, un teln corrido para blindar la vulnerabilidad, un escenario donde las emociones pasan a un segundo plano ante la manifestacin de la indiferencia.;Despectivo;18-08-2018 14:00;IndifferentFort;Instagram;#Desprecio #IndiferenciaActuacin;12;24;Australia;2018;8;18;14
331;335;Los sueos destrozados yacen en el suelo como fragmentos de vidrio, un mosaico de decepcin elaborado por las manos de la frustracin.;Frustrado;07-01-2022 11:10;DreamMosaic;Twitter;#Frustrado #MosaicoDeDecepcin;15;30;Canad;2022;1;7;11
332;336;La soledad, una compaera silenciosa en la noche, el nico eco en la cmara de la soledad, el nocturno solitario de un corazn.;Neutral;19-09-2019 3:30;NocturnalEcho;Facebook;#Soledad #NocturnoSolitario;18;36;Australia;2019;9;19;3
333;337;Impresionado por el impresionante amanecer sobre las montaas.;Positivo;03-04-2022 6:15;NatureAdmirer;Instagram;#Awe #ImpresionanteAmanecer;28;55;EE.UU;2022;4;3;6
334;338;Navegando a travs de los desafos con determinacin.;Neutral;12-10-2023 10:30;GoalPursuer;Twitter;#Determinacin #Retos;15;30;Canad;2023;10;12;10
335;339;La nostalgia te invade mientras hojeas un viejo lbum de fotos.;Neutral;28-06-2019 19:00;MemoryLane;Facebook;#Nostalgia #ViejosRecuerdos;22;45;Reino Unido;2019;6;28;19
336;340;Encantado de presenciar la grandeza de un festival cultural.;Emocin;15-09-2020 14:45;CultureEnthusiast;Instagram;#Emocin #CelebracinCultural;40;80;India;2020;9;15;14
337;341;Calma encontrada en el ritmo de las gotas de lluvia sobre el cristal de la ventana.;Neutral;08-11-2017 21:20;RainWatcher;Twitter;#Calma #DasLluviosos;18;35;Australia;2017;11;8;21
338;342;Abrumado por el apoyo recibido durante un desafo personal.;Positivo;20-05-2021 17:30;PersonalJourney;Facebook;#Overwhelmed #SupportiveCommunity;25;50;EE.UU;2021;5;20;17
339;343;La emocin aumenta a medida que comienza la cuenta regresiva para unas vacaciones tan esperadas.;Excitacin;10-01-2023 12:00;VacationDreamer;Instagram;#Emocin #CuentaRegresivaDeVacaciones;30;60;Francia;2023;1;10;12
340;344;Reflexionando sobre el camino de la vida, agradecido por las lecciones aprendidas.;Gratitud;05-12-2018 8:45;LifeLearner;Twitter;#Gratitud #LeccionesdeVida;35;70;Brasil;2018;12;5;8
341;345;Surgen emociones agridulces al despedirse de un querido amigo.;Neutral;15-03-2020 18:30;FarewellSender;Instagram;#Agridulce #Despedida;20;40;Japan;2020;3;15;18
342;346;La curiosidad surgi al explorar unas misteriosas ruinas antiguas.;Curiosidad;22-08-2016 15:10;HistoryExplorer;Facebook;#Curiosidad #DescubrimientoAntiguo;18;35;Grecia;2016;8;22;15
343;347;Admiracin por los intrincados detalles de una obra maestra hecha a mano.;Admiracin;20-08-2019 16:00;CraftEnthusiast;Instagram;#Admiracin #ArteArtesanal;25;50;EE.UU;2019;8;20;16
344;348;Alegra del calor de una acogedora chimenea en una tarde de invierno.;Positivo;08-12-2021 19:30;WinterLover;Twitter;#Alegra #CalorInvernal;18;35;Canad;2021;12;8;19
345;349;La inspiracin llega al observar los colores de una vibrante puesta de sol.;Neutral;10-06-2020 20:45;SunsetWatcher;Instagram;#Inspiracin #ColoridoAtardecer;30;60;Reino Unido;2020;6;10;20
346;350;Motivado para alcanzar objetivos de acondicionamiento fsico despus de un entrenamiento vigorizante.;Motivacin;28-02-2022 7:15;FitnessJunkie;Facebook;#Motivacin #MetasDeFitness;40;80;Australia;2022;2;28;7
347;351;Gratitud por las alegras simples que se encuentran en una taza de caf de la maana.;Gratitud;15-04-2017 8:00;CoffeeLover;Twitter;#Gratitud #CafdeLaMaana;22;45;India;2017;4;15;8
348;352;Sentirse empoderado despus de conquistar una ruta de senderismo desafiante.;Empoderamiento;05-09-2018 14:20;HikingExplorer;Instagram;#Empoderamiento #SenderismoAventura;35;70;EE.UU;2018;9;5;14
349;353;Divertido por las travesuras de los gatitos juguetones durante el juego.;Diversin;22-10-2022 12:45;KittyObserver;Facebook;#Diversin #GatitosJuguetones;15;30;Canad;2022;10;22;12
350;354;Contemplando los misterios de la vida bajo el cielo estrellado.;Neutral;02-07-2016 23:30;Stargazer;Twitter;#Contemplacin #NocheEstrellada;28;55;Reino Unido;2016;7;2;23
351;355;Un alegre reencuentro con amigos perdidos hace mucho tiempo despus de aos de separacin.;Positivo;18-11-2020 17:10;FriendshipRenewal;Instagram;#ReuninAlegre #Amistad;20;40;India;2020;11;18;17
352;356;La emocin aumenta mientras se prepara para una celebracin sorpresa.;Excitacin;05-03-2023 15:00;CelebrationPlanner;Facebook;#Emocin #CelebracinSorpresa;30;60;Australia;2023;3;5;15
353;357;Satisfaccin derivada de finalizar con xito un proyecto de bricolaje.;Satisfaccin;01-12-2015 11:30;DIYEnthusiast;Twitter;#Satisfaccin #ProyectoDIY;25;50;EE.UU;2015;12;1;11
354;358;Sentirse bendecido por la comunidad solidaria en momentos de necesidad.;Positivo;10-09-2021 9:45;CommunityHelper;Instagram;#Bendita #ComunidadSoportadora;18;35;Reino Unido;2021;9;10;9
355;359;Cautivado por la serenidad de un jardn tranquilo en plena floracin.;Serenidad;12-05-2018 14:20;GardenEnthusiast;Facebook;#Serenidad #JardnTranquilo;22;45;Canad;2018;5;12;14
356;360;Anticipacin por una prxima aventura en un destino extico.;Anticipacin;25-07-2022 10:00;Wanderlust;Twitter;#Anticipacin #AventuraEspera;40;80;India;2022;7;25;10
357;361;Reflexionar sobre el crecimiento personal alcanzado a travs de experiencias de vida.;Neutral;08-03-2019 18:30;GrowthSeeker;Instagram;#Reflexin #CrecimientoPersonal;35;70;EE.UU;2019;3;8;18
358;362;Los recuerdos nostlgicos inundan la mente mientras revisitamos los favoritos de la infancia.;Neutral;28-01-2017 21:15;ChildhoodMemories;Facebook;#Nostalgia #FavoritosDeLaInfancia;20;40;Australia;2017;1;28;21
359;363;Apreciacin por la vibrante cultura experimentada durante el viaje.;Apreciacin;14-11-2016 13:45;CultureExplorer;Twitter;#Apreciacin #ExperienciaCultural;28;55;Reino Unido;2016;11;14;13
360;364;La confianza se dispara despus de superar la ansiedad por hablar en pblico.;Confianza;02-04-2020 17:30;PublicSpeaker;Instagram;#Confianza #SuperarLaAnsiedad;15;30;EE.UU;2020;4;2;17
361;365;Contentamiento en medio de una reunin familiar llena de risas.;Positivo;15-01-2023 19:00;FamilyCelebration;Facebook;#Alegra #RisaFamilia;25;50;Canad;2023;1;15;19
362;366;Entusiasmo por aprender nuevas habilidades y ampliar conocimientos.;Entusiasmo;07-08-2018 12:15;LifelongLearner;Twitter;#Entusiasmo #Construccindehabilidades;30;60;India;2018;8;7;12
363;367;Sorprndete y deleitate al descubrir una joya escondida en la ciudad.;Sorpresa;18-10-2019 16:45;CityExplorer;Instagram;#Sorpresa #JoyaEscondida;18;35;Reino Unido;2019;10;18;16
364;368;Una sensacin de logro despus de completar un entrenamiento desafiante.;Logro;30-06-2022 7:00;FitnessAchiever;Facebook;#Logro #xitoFitness;22;45;Australia;2022;6;30;7
365;369;Asombro ante la belleza de un doble arcoris despus de la lluvia.;Admiracin;12-06-2017 18:20;RainbowChaser;Twitter;#Maravilla #DobleArcoiris;35;70;EE.UU;2017;6;12;18
366;370;Optimismo para un futuro brillante en tiempos difciles.;Optimismo;05-07-2021 9:30;FutureOptimist;Instagram;#Optimismo #FuturoBrillante;20;40;Canad;2021;7;5;9
367;371;Orgullo de lograr un hito personal en la progresin profesional.;Orgullo;15-04-2016 14:50;CareerAchiever;Facebook;#Orgullo #HitoCarrera;28;55;Reino Unido;2016;4;15;14
368;372;La felicidad florece como flores en un jardn en un da soleado.;Felicidad;10-02-2020 11:15;SunnyDayEnthusiast;Twitter;#Felicidad #DaSoleado;15;30;India;2020;2;10;11
369;373;Euforia por descubrir un libro raro en una librera pintoresca.;Euforia;22-09-2018 16:30;Bookworm;Instagram;#Euforia #DescubrimientodeLibrosRaros;40;80;EE.UU;2018;9;22;16
370;374;Curiosidad despertada por los misterios de un antiguo sitio arqueolgico.;Curiosidad;08-11-2015 10:00;ArchaeologyEnthusiast;Facebook;#Curiosidad #MisteriosAntiguos;18;35;Australia;2015;11;8;10
371;375;Hipnotizado por la danza csmica de lucirnagas en una noche de luna.;Encantamiento;10-08-2022 22:00;NightSkyObserver;Instagram;#Encantamiento #Lucirnagas Csmicas;25;50;Brasil;2022;8;10;22
372;376;Intrigado por la sinfona de colores en una exposicin de arte abstracto.;Neutral;05-04-2019 17:30;ArtConnoisseur;Twitter;#Intriga #ArteAbstracto;18;35;Francia;2019;4;5;17
373;377;Las risas y la alegra resuenan en el aire durante una cita para jugar con los nios.;Alegra;15-12-2020 15:45;PlayfulParent;Facebook;#PlayfulJoy #NiosPlaydate;22;45;Japan;2020;12;15;15
374;378;Envuelto en serenidad mientras practica junto al lago.;Neutral;20-10-2017 8:15;ZenSeeker;Instagram;#Mindfulness #LagoTranquilidad;35;70;Canad;2017;10;20;8
375;379;Persiguiendo sueos como una cometa volando alto en el vasto cielo abierto.;Positivo;28-02-2021 13:00;SkyDreamer;Twitter;#ChaserDream #SkyHighDreams;30;60;Australia;2021;2;28;13
376;380;Hechizado por la elegancia de un baile de saln bajo candelabros de cristal.;Elegancia;12-06-2018 20:30;DanceEnthusiast;Facebook;#Elegancia #Baile De Saln;28;55;Reino Unido;2018;6;12;20
377;381;Deleite caprichoso en un mundo de cuentos de hadas y criaturas mgicas.;Neutral;08-03-2016 14:20;FairyTaleExplorer;Instagram;#Whimsy #MundoMgico;20;40;EE.UU;2016;3;8;14
378;382;Contemplacin pensativa en medio de las antiguas ruinas de una civilizacin olvidada.;Neutral;18-04-2023 17:10;RuinsExplorer;Twitter;#Pensativo #CivilizacinAntigua;18;35;Grecia;2023;4;18;17
379;383;Abrazando la emocin de la velocidad en los emocionantes giros de una montaa rusa.;Emocin;25-07-2020 12:45;RollercoasterFan;Facebook;#Emocin #AventuraEnMontaaRusa;22;45;Alemania;2020;7;25;12
380;384;La armona resuena cuando los msicos tocan una meloda de unidad y unin.;Armona;30-11-2019 19:30;MusicHarmonist;Instagram;#Armona #UnidadMusical;35;70;Suecia;2019;11;30;19
381;385;Un estallido de creatividad en la tranquila soledad del estudio de un artista.;Creatividad;01-09-2015 16:00;StudioArtist;Twitter;#Creatividad #ArtistasRefugio;15;30;Italia;2015;9;1;16
382;386;Alegra radiante similar a las flores floreciendo en una maana de primavera baada por el sol.;Resplandor;05-05-2022 10:15;SpringEnthusiast;Facebook;#Resplandor #Floresdeprimavera;25;50;Pases Bajos;2022;5;5;10
383;387;Una sensacin de asombro ante la inmensidad del cosmos en una noche de observacin de estrellas.;Neutral;08-07-2018 23:00;CosmosExplorer;Instagram;#Maravilla #AventuraObservacindeestrellas;40;80;Sudfrica;2018;7;8;23
384;388;Rejuvenecido por la brisa salada y el sonido de las olas a la orilla del mar.;Neutral;20-09-2021 14:30;SeaBreezeLover;Twitter;#Rejuvenecimiento #Escape junto al mar;18;35;Espaa;2021;9;20;14
385;389;Susurros de inspiracin provenientes del susurro de las hojas en un bosque sereno.;Neutral;15-11-2016 11:45;ForestDreamer;Facebook;#Inspiracin #SusurrosBosque;28;55;Portugal;2016;11;15;11
386;390;Saboreando el calor de una taza de chocolate en una fra noche de invierno.;Neutral;12-01-2020 18:00;WinterWarmth;Instagram;#Comodidad #Tardedeinviernoclida;30;60;Suiza;2020;1;12;18
387;391;Agradecimiento de todo corazn por las risas compartidas durante una reunin familiar.;Positivo;28-12-2017 19:15;FamilyGatherer;Facebook;#Gratitud #RisaFamilia;22;45;Austria;2017;12;28;19
388;392;Embrcate en una aventura culinaria, saboreando sabores exticos de todo el mundo.;Neutral;02-03-2019 20:20;CulinaryExplorer;Twitter;#Aventura #ViajeCulinario;35;70;Blgica;2019;3;2;20
389;393;La euforia inunda cuando la ltima pieza del rompecabezas encaja en su lugar.;Euforia;08-06-2022 15:30;PuzzleSolver;Instagram;#Euforia #PuzzleCompletion;20;40;Dinamarca;2022;6;8;15
390;394;Impresionado por la grandeza de la intrincada arquitectura de una antigua catedral.;Positivo;18-08-2018 14:45;CathedralVisitor;Facebook;#Awe #ArquitectnicaGrandeza;18;35;Repblica Checa;2018;8;18;14
391;395;Cautivado por la belleza etrea de un campo lleno de lucirnagas.;Encantamiento;10-08-2022 22:00;NightSkyObserver;Instagram;#Encantamiento #Campodelucirnagas;25;50;Brasil;2022;8;10;22
392;396;Inmerso en las encantadoras melodas del violn de un msico callejero.;Meldico;05-04-2019 17:30;MusicLover;Twitter;#MsicaMeldica #Street;18;35;Francia;2019;4;5;17
393;397;La risa alegre resuena en un animado carnaval de verano.;Alegra;15-12-2020 15:45;CarnivalGoer;Facebook;#AlegraFestiva #CarnavalDeVerano;22;45;Japan;2020;12;15;15
394;398;Explorando el universo interior durante una sesin de meditacin consciente.;Neutral;20-10-2017 8:15;MindfulExplorer;Instagram;#ViajeInterior #MeditacinBliss;35;70;Canad;2017;10;20;8
395;399;Elevndose como un espritu libre sobre los vientos de un acantilado costero.;Neutral;28-02-2021 13:00;CoastalExplorer;Twitter;#Libertad #AventuraCostera;30;60;Australia;2021;2;28;13
396;400;Deslumbrado por la elegancia de los deslumbrantes trajes de un baile de mscaras.;Deslumbrar;12-06-2018 20:30;MasqueradeAttendee;Facebook;#Deslumbra #MascaradaElegancia;28;55;Reino Unido;2018;6;12;20
397;401;Deleite caprichoso en un mundo de cuentos de hadas caprichosos.;Neutral;08-03-2016 14:20;FairyTaleAdventurer;Instagram;#Caprichoso #MagiadeCuentodeHadas;20;40;EE.UU;2016;3;8;14
398;402;Contemplacin reflexiva en medio de las ruinas de una poca olvidada.;Reflexin;18-04-2023 17:10;RuinsExplorer;Twitter;#Reflexin #EraOlvidada;18;35;Grecia;2023;4;18;17
399;403;Montar la adrenalina en los giros salvajes de una montaa rusa.;Positivo;25-07-2020 12:45;ThrillSeeker;Facebook;#Adrenalina #Emociones De Montaa Rusa;22;45;Alemania;2020;7;25;12
400;404;La armona resuena mientras los msicos tocan una sinfona de unidad.;Armona;30-11-2019 19:30;MusicHarmonist;Instagram;#Armona #UnidadMusical;35;70;Suecia;2019;11;30;19
401;405;Un estallido de creatividad artstica en la tranquilidad del estudio de un artista. #ArteClub;Positivo;01-09-2015 16:00;StudioArtist;Twitter;#ExplosinArtstica #CreatividaddeEstudio;15;30;Italia;2015;9;1;16
402;406;Alegra radiante similar a las flores floreciendo en una soleada maana de primavera.;Resplandor;05-05-2022 10:15;SpringEnthusiast;Facebook;#Resplandor #Floresdeprimavera;25;50;Pases Bajos;2022;5;5;10
403;407;Asombrado por la inmensidad del cosmos en una noche de observacin de estrellas.;Neutral;08-07-2018 23:00;CosmosExplorer;Instagram;#Maravilla #AventuraObservacindeestrellas;40;80;Sudfrica;2018;7;8;23
404;408;Rejuvenecido por la brisa salada y el sonido de las olas a la orilla del mar.;Neutral;20-09-2021 14:30;SeaBreezeLover;Twitter;#Rejuvenecimiento #Escape junto al mar;18;35;Espaa;2021;9;20;14
405;409;Susurros de inspiracin provenientes del susurro de las hojas en un bosque sereno.;Neutral;15-11-2016 11:45;ForestDreamer;Facebook;#Inspiracin #SusurrosBosque;28;55;Portugal;2016;11;15;11
406;410;Saboreando el calor de una taza de chocolate en una fra noche de invierno.;Neutral;12-01-2020 18:00;WinterWarmth;Instagram;#Comodidad #Tardedeinviernoclida;30;60;Suiza;2020;1;12;18
407;411;Agradecimiento de todo corazn por las risas compartidas durante una reunin familiar.;Positivo;28-12-2017 19:15;FamilyGatherer;Facebook;#Gratitud #RisaFamilia;22;45;Austria;2017;12;28;19
408;412;Embrcate en una odisea culinaria, saboreando sabores de todo el mundo.;Neutral;02-03-2019 20:20;CulinaryExplorer;Twitter;#OdiseaCulinaria #SaboresEnElMundo;35;70;Blgica;2019;3;2;20
409;413;La euforia inunda cuando la ltima pieza del rompecabezas encaja perfectamente.;Euforia;08-06-2022 15:30;PuzzleSolver;Instagram;#Euforia #RompecabezasPerfecto;20;40;Dinamarca;2022;6;8;15
410;414;Asombrado por la grandeza de la intrincada arquitectura de una antigua catedral.;Positivo;18-08-2018 14:45;CathedralVisitor;Facebook;#Awe #ArquitectnicaGrandeza;18;35;Repblica Checa;2018;8;18;14
411;415;Curiosidad que despiertan los misterios de un antiguo yacimiento arqueolgico.;Curiosidad;08-11-2015 10:00;ArchaeologyEnthusiast;Instagram;#Curiosidad #MisteriosAntiguos;18;35;Australia;2015;11;8;10
412;416;Vertiginosos de emocin mientras los primeros copos de nieve bailan desde el cielo.;Excitacin;02-12-2020 17:30;SnowfallEnthusiast;Twitter;#Emocin #NevadaMagia;22;45;Canad;2020;12;2;17
413;417;La alegra envuelve mientras el aroma del pan recin horneado llena el aire.;Positivo;10-06-2017 12:15;BreadLover;Instagram;#Alegra #AromaDePanFresco;28;55;Francia;2017;6;10;12
414;418;Inspirado en la resistencia de un rbol solitario erguido en medio de una tormenta.;Resiliencia;15-04-2021 14:20;NatureResilient;Facebook;#Resiliencia #De Pie En Alto;35;70;EE.UU;2021;4;15;14
415;419;Perdido en las pginas de una novela cautivadora, transportado a otro mundo.;Neutral;28-09-2019 19:45;Bookworm;Twitter;#Inmersin #NovelaCautivadora;20;40;Reino Unido;2019;9;28;19
416;420;Empapado de nostalgia mientras hojeaba un viejo lbum de fotos familiar.;Neutral;05-12-2016 21:00;FamilyHistorian;Instagram;#Nostalgia #lbumDeFotosFamiliares;25;50;India;2016;12;5;21
417;421;Una chispa de inspiracin se enciende como una estrella fugaz en el cielo nocturno.;Positivo;10-02-2018 23:30;NightSkyWatcher;Facebook;#Chispa #InspiracinEncendido;30;60;Australia;2018;2;10;23
418;422;Imbuido de gratitud por el simple placer de una taza de t caliente.;Gratitud;15-02-2023 8:30;TeaEnthusiast;Twitter;#Gratitud #TCaliente;18;35;Japan;2023;2;15;8
419;423;Maravillarse ante el caleidoscopio de colores en un vibrante mercado callejero.;Maravilla;22-08-2015 15:00;MarketExplorer;Instagram;#Marvel #ColorfulStreetMarket;22;45;Brasil;2015;8;22;15
420;424;Inundado de serenidad mientras el sol se pone en un tranquilo refugio junto al lago.;Serenidad;20-11-2020 18:45;LakesideRetreater;Facebook;#Serenidad #AtardecerTranquilo;28;55;Alemania;2020;11;20;18
421;425;Ahogndose en el dolor mientras resurgen los recuerdos del amor perdido.;Negativo;05-08-2019 21:00;LostInLove;Instagram;#Desamor #AmorPerdido;15;30;EE.UU;2019;8;5;21
422;426;El entumecimiento aparece a medida que el peso de la soledad se hace ms pesado.;Soledad;12-02-2021 16:45;SolitudeSeeker;Twitter;#Soledad #CoraznPesado;18;35;Canad;2021;2;12;16
423;427;Las lgrimas caen como gotas de lluvia, lamentando el fin de una amistad querida.;Dolor;28-11-2020 14:20;FriendshipsEnd;Facebook;#Duelo #AmistadPerdida;22;45;Reino Unido;2020;11;28;14
424;428;La desesperacin nubla la mente, sintindose a la deriva en un mar interminable de oscuridad.;Desesperacin;15-05-2016 22:30;LostInDarkness;Instagram;#Desesperacin #OscuridadInfinita;28;55;Australia;2016;5;15;22
425;429;Destrozada por la traicin, la confianza se desmorona como un cristal frgil.;Traicin;10-09-2018 13:15;BrokenTrust;Twitter;#Traicin #Confianzadestrozada;22;45;Alemania;2018;9;10;13
426;430;Corazn dolorido, la sinfona del dolor suena en el silencio de la soledad.;Sufrimiento;20-03-2022 19:30;SilentSufferer;Facebook;#Sufrimiento #AngustiaSinfona;25;50;Brasil;2022;3;20;19
427;431;Tormenta emocional, un torbellino detristeza envuelve cada pensamiento.;Emocin;18-07-2017 17:45;StormyFeelings;Instagram;#TormentaEmocional #TristezazaTormenta;30;60;India;2017;7;18;17
428;432;Atormentado por los arrepentimientos, el fantasma del pasado persiste implacablemente.;Arrepentimiento;15-12-2018 10:00;LingeringGhost;Twitter;#Arrepentimiento #PasadoEmbrujado;18;35;Francia;2018;12;15;10
429;433;Desgarrado por el dolor, los ecos de la prdida resuenan en el alma.;Dolor;28-06-2015 21:15;EchoesOfLoss;Facebook;#Duelo #Desgarrado;28;55;Italia;2015;6;28;21
430;434;El aislamiento se profundiza, un invierno emocional donde la calidez no es ms que un recuerdo lejano.;Aislamiento;02-04-2020 14:20;WinterOfEmotions;Instagram;#Aislamiento #InviernoEmocional;35;70;Japan;2020;4;2;14
431;435;Decepcin desgarradora, esperanzas destrozadas como vidrio frgil.;Decepcin;08-10-2019 18:30;ShatteredHopes;Twitter;#Decepcin #EsperanzasAplastadas;20;40;Espaa;2019;10;8;18
432;436;Ecos dolorosos de un amor una vez apreciado, ahora perdido en el abismo del tiempo.;Desamor;22-11-2016 9:45;AbyssOfTime;Facebook;#AmorPerdido #EcosDolorosos;22;45;Pases Bajos;2016;11;22;9
433;437;La angustia se profundiza, un viaje solitario a travs del abismo de la desesperacin.;Desesperacin;18-08-2022 22:00;SolitaryDescent;Instagram;#Desesperacin #AbismoDeAngustia;40;80;Sudfrica;2022;8;18;22
434;438;La melancola perdura, una serenata agridulce en la quietud de la soledad.;Neutral;12-03-2017 23:30;SerenadeOfSolitude;Twitter;#Melancola #SerenataTranquila;18;35;Reino Unido;2017;3;12;23
435;439;Amargura como un veneno, filtrndose en cada grieta del corazn herido.;Negativo;15-12-2015 16:15;PoisonedHeart;Facebook;#Amargura #CoraznHerido;25;50;Australia;2015;12;15;16
436;440;Agotamiento emocional, el peso del mundo aplastando los hombros cansados.;Negativo;05-09-2021 13:30;WearySoulCrushed;Instagram;#Agotamiento #EsprituAplastado;35;70;Canad;2021;9;5;13
437;441;Ecos dolorosos, una sinfona de dolor tocada por las cuerdas de la prdida.;Pena;22-05-2018 20:45;StringsOfSorrow;Twitter;#Dolor #SinfonaDePrdida;18;35;Alemania;2018;5;22;20
438;442;La oscuridad desciende y envuelve el alma en las sombras de la desesperacin.;Neutral;10-07-2016 18:20;SoulInShadow;Facebook;#Oscuridad #AlmaEngullida;28;55;EE.UU;2016;7;10;18
439;443;Los susurros de desesperacin, la splica silenciosa por un rayo de esperanza en el abismo.;Negativo;30-04-2019 14:00;WhisperedDespair;Instagram;#Desesperacin #GlimmerOfHope;22;45;Francia;2019;4;30;14
440;444;Corazn en ruinas, restos de sueos destrozados esparcidos por el viento.;Negativo;08-01-2022 11:30;DreamsInWind;Twitter;#Ruinas #SueosDestrozados;20;40;Brasil;2022;1;8;11
441;445;Destrozados por los ecos de un sueo destrozado, fragmentos de esperanza se dispersaron.;Soledad;10-09-2017 19:15;DreamEchoes;Twitter;#Desolacin #Esperanzadispersa;20;40;Australia;2017;9;10;19
442;446;Evitando las espinas del arrepentimiento, caminando descalzo por el camino del remordimiento.;Arrepentimiento;18-04-2022 11:30;RemorseWalker;Instagram;#Arrepentimiento #CaminoDeRemordimiento;25;50;Canad;2022;4;18;11
443;447;En el laberinto del dolor, en las paredes resuenan los pasos de la alegra perdida.;Dolor;05-12-2018 21:45;JoyLabyrinth;Facebook;#Duelo #AlegraPerdidaPasos;18;35;EE.UU;2018;12;5;21
444;448;Un alma a la deriva en el mar de la soledad, olas de soledad rompiendo implacablemente.;Soledad;28-06-2016 14:20;SolitudeSeas;Twitter;#Soledad #OlasRompiendo;22;45;Reino Unido;2016;6;28;14
445;449;La amargura de la traicin, un sabor que perdura, manchando el paladar de la confianza.;Amargura;22-10-2019 17:00;PalateStainer;Instagram;#Amargura #ConfianzaManchada;15;30;Alemania;2019;10;22;17
446;450;En las ruinas de la esperanza, los ecos de los sueos destrozados susurran historias de prdida.;Soledad;15-03-2021 22:45;HopeRuins;Facebook;#Desolacin #PrdidaSusurrada;28;55;Brasil;2021;3;15;22
447;451;Hundiendo como una piedra en el ocano del desamor, cada onda es un suspiro de desesperacin.;Desamor;10-08-2017 19:30;OceanSinker;Twitter;#Desamor #RippleOfDespair;22;45;Francia;2017;8;10;19
448;452;Lgrimas, la tinta que mancha las pginas de un diario, testimonio de un dolor silencioso.;Dolor;28-01-2023 14:30;InkJournalist;Instagram;#Duelo #Lgrimas silenciosas;30;60;India;2023;1;28;14
449;453;En el pramo de la confianza perdida, resuenan los ecos de las promesas incumplidas.;Traicin;12-12-2016 10:00;TrustWasteland;Facebook;#Traicin #PromesasReverberantes;25;50;Italia;2016;12;12;10
450;454;Evitando los fragmentos de sueos destrozados, caminando sobre la cuerda floja de la resiliencia.;Resiliencia;18-07-2020 15:15;DreamTightrope;Twitter;#Resiliencia #Caminata por la cuerda floja;35;70;Japan;2020;7;18;15
451;455;Asfixindose en el silencio de la soledad, donde una vez prosperaron los ecos de la risa.;Aislamiento;20-05-2022 20:30;EchoedLaughter;Instagram;#Aislamiento #SoledadSilencio;30;60;Sudfrica;2022;5;20;20
452;456;Atormentado por el espectro de las posibilidades perdidas, un fantasma que se niega a desvanecerse.;Arrepentimiento;08-11-2019 14:45;PossibilityGhost;Twitter;#Arrepentimiento #Desvanecimientodeposibilidades;18;35;Espaa;2019;11;8;14
453;457;En el laberinto de la desesperacin, los ecos de un corazn roto resuenan sin cesar.;Desesperacin;28-03-2017 22:00;EndlessLabyrinth;Facebook;#Desesperacin #ReverberacinSinFin;28;55;Australia;2017;3;28;22
454;458;Hundindonos como hojas de otoo en el ro del dolor, arrastrados por la corriente.;Pena;15-09-2020 18:15;RiverOfSorrow;Instagram;#Dolor #Hojas de Otoo;22;45;Canad;2020;9;15;18
455;459;En el jardn de los sueos rotos, caen los ptalos, un testimonio silencioso de esperanzas destrozadas.;Soledad;10-06-2018 13:30;DreamGardener;Twitter;#Desolacin #Esperanzasdestrozadas;20;40;Reino Unido;2018;6;10;13
456;460;Lgrimas, la moneda del dolor, gastadas en el mercado del amor y el anhelo perdidos.;Dolor;22-12-2016 21:45;CurrencyOfTears;Facebook;#Duelo #AmorPerdidoAnhelo;25;50;EE.UU;2016;12;22;21
457;461;Vagando en el laberinto de la traicin, los muros se cierran con cada giro equivocado.;Traicin;05-01-2021 16:20;MazeWanderer;Instagram;#Traicin #CerrandoMuros;15;30;Alemania;2021;1;5;16
458;462;Un alma capeada por la tormenta del desamor, que busca refugio en la calma posterior.;Desamor;18-04-2019 11:00;StormSeeker;Twitter;#Desamor #CalmaDespusdeLaTormenta;22;45;Brasil;2019;4;18;11
459;463;En el tapiz de la desesperacin, se desenredan hilos de esperanza, dejando un retrato de dolor.;Desesperacin;28-08-2017 19:30;TapestrySorrow;Facebook;#Desesperacin #EsperanzaDesenredada;18;35;India;2017;8;28;19
460;464;Como una rosa marchita en el jardn del amor, los ptalos caen, una silenciosa rendicin al tiempo.;Prdida;10-02-2023 14:30;WitheredRose;Instagram;#Prdida #Rendicin Silenciosa;28;55;Francia;2023;2;10;14
461;465;En el vaco del dolor, suenan los ecos de una cancin de amor, cada nota es una punzada de anhelo.;Angustia;10-07-2022 22:15;LoveSongEcho;Instagram;#Angustia #AmorCancinAnhelo;30;60;Japan;2022;7;10;22
462;466;Nostalgia, un baile agridulce en el saln de baile de recuerdos preciados iluminado por la luna.;Neutral;15-05-2019 21:30;MoonlitMemories;Twitter;#Nostalgia #RecuerdosCherished;18;35;Italia;2019;5;15;21
463;467;En la sinfona del dolor, cada lgrima es una nota que compone una meloda melanclica.;Dolor;28-11-2018 14:00;SymphonyOfTears;Facebook;#Duelo #MelodaMelanclica;22;45;Alemania;2018;11;28;14
464;468;Traicin, una serpiente venenosa que se desliza por el jardn de la confianza, envenenando las races.;Traicin;02-03-2021 17:45;VenomousGarden;Instagram;#Traicin #ConfianzaEnvenenada;25;50;Canad;2021;3;2;17
465;469;Hundiendo en las arenas movedizas de la desesperacin, cuanto ms luchas, ms profundo desciendes.;Desesperacin;18-10-2016 19:30;QuicksandFighter;Twitter;#Desesperacin #DescensoProfundo;20;40;EE.UU;2016;10;18;19
466;470;Vagando por el cementerio de los sueos perdidos, lpidas que marcan penas incalculables.;Soledad;15-08-2020 12:30;DreamCemetery;Facebook;#Desolacin #Dolores Incalculables;28;55;Francia;2020;8;15;12
467;471;Arrastrado por el ro del arrepentimiento, las corrientes del pasado se niegan a liberarse.;Arrepentimiento;28-04-2017 16:20;RegretRiver;Instagram;#Arrepentimiento #ActualidadesPasadas;18;35;Reino Unido;2017;4;28;16
468;472;Los susurros de amor perdido persisten en el tico del corazn, olvidados pero no borrados.;Negativo;10-09-2019 21:00;HeartAttic;Twitter;#Prdida #AmorOlvidado;22;45;Australia;2019;9;10;21
469;473;En la galera de promesas incumplidas, cada voto destrozado enmarcaba una dolorosa exposicin.;Traicin;28-01-2022 13:45;PromiseGallery;Facebook;#Traicin #VotosDestrozados;15;30;Brasil;2022;1;28;13
470;474;Los ecos de la soledad, una conversacin silenciosa entre un alma y sus sombras.;Neutral;15-06-2016 22:30;EchoedConversation;Instagram;#Soledad #ConversacinSombra;30;60;Espaa;2016;6;15;22
471;475;Bailando bajo el sol, cada paso es una celebracin de la alegra que se encuentra en los momentos simples.;Alegra;20-08-2021 15:45;SunshineDancer;Instagram;#Alegra #MomentosSimples;40;80;EE.UU;2021;8;20;15
472;476;La risa resuena en el aire, un coro de felicidad que eleva el espritu.;Felicidad;12-04-2018 18:30;EchoedLaughter;Twitter;#Felicidad #LevantadorEspritu;35;70;Canad;2018;4;12;18
473;477;En el jardn de la alegra, cada flor susurra historias de paz interior y alegra.;Contentamiento;15-02-2022 12:20;GardenOfJoy;Facebook;#Alegra #PazInterior;25;50;Reino Unido;2022;2;15;12
474;478;Persiguiendo sueos bajo el cielo vibrante, un viaje alimentado por la esperanza y el entusiasmo.;Entusiasmo;28-10-2019 14:15;DreamChaser;Instagram;#Entusiasmo #ViajeEsperanza;30;60;Australia;2019;10;28;14
475;479;Serenata a las estrellas con un corazn lleno de gratitud, una meloda de agradecimiento.;Gratitud;22-12-2017 21:00;StarSerenader;Twitter;#Gratitud #MelodaAgradecida;22;45;India;2017;12;22;21
476;480;Disfrutando del brillo del logro, cada hito es un trampoln hacia la felicidad.;Logro;10-06-2020 17:30;GlowAchiever;Facebook;#Logro #FelicidadHito;28;55;Alemania;2020;6;10;17
477;481;En la danza de la positividad, cada paso es un ritmo que eleva el alma en armona.;Positividad;18-09-2016 19:45;DanceHarmony;Instagram;#Positividad #Elevacindelalma;18;35;Francia;2016;9;18;19
478;482;Rebosante de alegra, una taza de risa compartida con amigos, un momento apreciado.;Alegra;10-03-2023 14:30;LaughterCup;Twitter;#Alegra #MomentoApreciado;20;40;Japan;2023;3;10;14
479;483;Envuelta en la calidez de la bondad, una colcha de compasin cosida con amor.;Amabilidad;05-05-2019 12:15;QuiltedCompassion;Facebook;#Amabilidad #PuntadasdeAmor;25;50;Brasil;2019;5;5;12
480;484;En el jardn de las amistades, cada flor es un testimonio de la belleza de la camaradera.;Amistad;28-08-2018 16:00;FriendshipGarden;Instagram;#Amistad #FloreceCamaradera;30;60;Sudfrica;2018;8;28;16
481;485;En el abrazo del amor, cada latido es una meloda que baila al ritmo del afecto.;Amor;15-11-2022 20:45;MelodyOfLove;Twitter;#Amor #RitmoDeAfecto;35;70;EE.UU;2022;11;15;20
482;486;Rodeado de los colores de la alegra, un lienzo pintado de risas y sonrisas infinitas.;Alegra;02-07-2019 17:00;ColorfulLaughter;Instagram;#Alegra #SonrisasSinFin;40;80;Canad;2019;7;2;17
483;487;En la sinfona de la emocin, cada nota es un estallido de energa que enciende el alma con fervor.;Excitacin;18-04-2021 14:20;SymphonyFervor;Facebook;#Emocin #AlmaEncendida;30;60;Reino Unido;2021;4;18;14
484;488;Un regalo sorpresa, envuelto en anticipacin, desarrolla un momento de deleite y asombro.;Sorpresa;05-02-2023 19:30;WrappedDelight;Twitter;#Sorpresa #MomentoMaravilloso;25;50;Australia;2023;2;5;19
485;489;Perdido en el laberinto de la curiosidad, cada giro revela los tesoros del descubrimiento.;Neutral;22-09-2018 12:45;MazeDiscovery;Instagram;#Curiosidad #TesorosdelDescubrimiento;22;45;India;2018;9;22;12
486;490;Flotando sobre nubes de gratitud, cada gota de lluvia es una bendicin, una lluvia de agradecimiento.;Gratitud;10-12-2016 21:15;CloudsOfBlessings;Facebook;#Gratitud #DuchaDeAgradecimiento;28;55;Alemania;2016;12;10;21
487;491;Como un cometa de inspiracin, surcando el cielo de la creatividad, dejando estelas de brillantez.;Neutral;28-05-2020 16:00;CometCreativity;Twitter;#Inspiracin #SenderosBrillantes;18;35;Francia;2020;5;28;16
488;492;En la celebracin del xito, los fuegos artificiales de los logros iluminan el cielo nocturno del triunfo.;xito;15-11-2017 22:30;FireworksTriumph;Instagram;#xito #TriunfoCieloNocturno;22;45;Japan;2017;11;15;22
489;493;Una sinfona de risas, cada nota es una llave para abrir la puerta de la felicidad ilimitada.;Felicidad;02-08-2021 19:00;LaughterSymphony;Facebook;#Felicidad #RisasSin lmites;30;60;Brasil;2021;8;2;19
490;494;En el carnaval de las emociones, la montaa rusa de emociones enva al corazn a un viaje salvaje.;Emocin;28-03-2019 15:30;EmotionCarnival;Instagram;#Emocin #PaseoCoraznSalvaje;35;70;Sudfrica;2019;3;28;15
491;495;De pie ante la grandeza de la Torre Eiffel, un momento para reflexionar sobre la belleza de los sueos parisinos.;Reflexin;12-05-2018 17:30;ParisDreamer;Twitter;#Reflexin #SueosParisinos;28;55;Francia;2018;5;12;17
492;496;Perdidos en el encanto de Disneylandia, cada uno de ellos emprende un viaje al reino de las fantasas infantiles.;Encantamiento;28-09-2022 15:45;DisneylandExplorer;Instagram;#Encantamiento #FantasasInfantiles;30;60;EE.UU;2022;9;28;15
493;497;Explorando las maravillas de Ferrari World, el rugido de los motores crea una sinfona de velocidad.;Excitacin;10-11-2019 14:00;FerrariSpeedster;Facebook;#Emocin #SinfonaDeVelocidad;22;45;Italia;2019;11;10;14
494;498;En medio de los campos de tulipanes de Keukenhof, un tapiz de colores que pinta el alma con la alegra primaveral.;Alegra;02-04-2021 18:20;KeukenhofAdventurer;Instagram;#Alegra #ColoresPrimavera;35;70;Pases Bajos;2021;4;2;18
495;499;Paseando por las calles histricas de Kioto, cada paso ser un viaje al corazn de las tradiciones de Japn.;Neutral;22-08-2017 21:30;KyotoAdventurer;Twitter;#Exploracin #Tradiciones Japonesas;18;35;Japan;2017;8;22;21
496;500;En el abrazo del Gran Can, la obra maestra de la naturaleza, un momento para maravillarse ante la grandeza de la Tierra.;Positivo;15-06-2020 16:45;CanyonMarveler;Instagram;#Awe #EarthsGrandeur;25;50;EE.UU;2020;6;15;16
497;501;Viajando a travs de la serenidad de Santorini, donde cada atardecer pinta el cielo con tonos de tranquilidad.;Serenidad;10-09-2016 19:15;SantoriniTraveler;Facebook;#Serenidad #SunsetTonos;22;45;Grecia;2016;9;10;19
498;502;Sorprndete con las maravillas arquitectnicas de Petra, cada piedra cuenta historias de una civilizacin antigua.;Asombro;28-01-2023 13:00;PetraExplorer;Twitter;#Asombro #CuentosAntiguos;30;60;Jordn;2023;1;28;13
499;503;Embarcndose en un paseo en gndola por Venecia, cada canal refleja el romance de esta ciudad eterna.;Romance;18-04-2019 16:30;VeniceRomantic;Instagram;#Romance #CiudadEterno;20;40;Italia;2019;4;18;16
500;504;En la cima de Machu Picchu, un panorama impresionante que susurra los secretos de las civilizaciones antiguas.;Positivo;05-11-2017 22:00;MachuPicchuAdventurer;Facebook;#Awe #Civilizaciones Antiguas;28;55;Per;2017;11;5;22
501;505;En el corazn de la ciudad de Nueva York, Times Square deslumbra con luces, un espectculo vibrante de energa urbana.;Excitacin;20-07-2022 21:45;TimesSquareExplorer;Instagram;#Emocin #EnergaUrbana;35;70;EE.UU;2022;7;20;21
502;506;Cautivado por el encanto histrico del Coliseo, cada piedra refleja historias del valor de los gladiadores.;Cautivacin;15-03-2018 17:30;ColosseumAdventurer;Twitter;#Cautivacin #CuentosdeGladiadores;25;50;Italia;2018;3;15;17
503;507;Navegando por las aguas azules de las Maldivas, cada ola es un susurro de serenidad en el paraso.;Serenidad;28-10-2019 14:15;MaldivesSailor;Facebook;#Serenidad #SusurrosParaso;22;45;Maldivas;2019;10;28;14
504;508;En medio de la selva amaznica, una sinfona de vida salvaje crea una orquesta de maravillas de la naturaleza.;Neutral;10-06-2021 16:00;AmazonExplorer;Instagram;#Maravilla #NaturalezaOrquesta;30;60;Brasil;2021;6;10;16
505;509;Al caminar por la Gran Muralla China, cada paso es un testimonio de las antiguas maravillas de la ingeniera.;Positivo;18-08-2017 19:30;GreatWallWalker;Twitter;#Awe #IngenieraMaravillas;18;35;Porcelana;2017;8;18;19
506;510;En la cima del monte Fuji, un amanecer impresionante que pinta el cielo con tonos de logro.;Logro;15-04-2020 5:30;FujiSummitAchiever;Facebook;#Logro #AmanecerTonos;28;55;Japan;2020;4;15;5
507;511;Explorando las antiguas ruinas de Angkor Wat, cada piedra susurra historias de la civilizacin jemer.;Neutral;22-11-2016 13:00;AngkorWatAdventurer;Instagram;#Exploracin #Historias jemeres;20;40;Camboya;2016;11;22;13
508;512;Al bajar esquiando por las laderas de los Alpes suizos, cada vuelta es un baile con la majestuosidad de los picos nevados.;Neutral;10-01-2019 14:45;AlpsSkiAdventurer;Twitter;#Aventura #BaileNieve;22;45;Suiza;2019;1;10;14
509;513;En la tranquilidad del bosque de bamb de Kioto, los susurros de la antigua sabidura Zen resuenan entre las arboledas.;Neutral;28-02-2023 16:20;KyotoBambooSeeker;Facebook;#Tranquilidad #SabiduraZen;25;50;Japan;2023;2;28;16
510;514;Navegando por los fiordos de Noruega, cada paisaje helado es una impresionante obra maestra de la grandeza de la naturaleza.;Grandeza;28-05-2018 18:30;NorwayFjordExplorer;Instagram;#Grandeza #ObraMaestraIcy;22;45;Noruega;2018;5;28;18
511;515;En la primera fila del concierto de Adele, cada nota de 'Someone Like You' resuena con una emocin conmovedora.;Emocin;15-09-2022 20:00;AdeleConcertGoer;Instagram;#Emocin #AdeleConcierto;40;80;EE.UU;2022;9;15;20
